Date,Year,Month,Day,Quarter,Start of Quarter,Start of Month,Start of Week,Day Name,Season,Is_Weekend
3/1/2020,2020,3,1,1,1/1/2020,3/1/2020,3/1/2020,Sunday,Spring,1
3/2/2020,2020,3,2,1,1/1/2020,3/1/2020,3/1/2020,Monday,Spring,0
3/3/2020,2020,3,3,1,1/1/2020,3/1/2020,3/1/2020,Tuesday,Spring,0
3/4/2020,2020,3,4,1,1/1/2020,3/1/2020,3/1/2020,Wednesday,Spring,0
3/5/2020,2020,3,5,1,1/1/2020,3/1/2020,3/1/2020,Thursday,Spring,0
3/6/2020,2020,3,6,1,1/1/2020,3/1/2020,3/1/2020,Friday,Spring,0
3/7/2020,2020,3,7,1,1/1/2020,3/1/2020,3/1/2020,Saturday,Spring,1
3/8/2020,2020,3,8,1,1/1/2020,3/1/2020,3/8/2020,Sunday,Spring,1
3/9/2020,2020,3,9,1,1/1/2020,3/1/2020,3/8/2020,Monday,Spring,0
3/10/2020,2020,3,10,1,1/1/2020,3/1/2020,3/8/2020,Tuesday,Spring,0
3/11/2020,2020,3,11,1,1/1/2020,3/1/2020,3/8/2020,Wednesday,Spring,0
3/12/2020,2020,3,12,1,1/1/2020,3/1/2020,3/8/2020,Thursday,Spring,0
3/13/2020,2020,3,13,1,1/1/2020,3/1/2020,3/8/2020,Friday,Spring,0
3/14/2020,2020,3,14,1,1/1/2020,3/1/2020,3/8/2020,Saturday,Spring,1
3/15/2020,2020,3,15,1,1/1/2020,3/1/2020,3/15/2020,Sunday,Spring,1
3/16/2020,2020,3,16,1,1/1/2020,3/1/2020,3/15/2020,Monday,Spring,0
3/17/2020,2020,3,17,1,1/1/2020,3/1/2020,3/15/2020,Tuesday,Spring,0
3/18/2020,2020,3,18,1,1/1/2020,3/1/2020,3/15/2020,Wednesday,Spring,0
3/19/2020,2020,3,19,1,1/1/2020,3/1/2020,3/15/2020,Thursday,Spring,0
3/20/2020,2020,3,20,1,1/1/2020,3/1/2020,3/15/2020,Friday,Spring,0
3/21/2020,2020,3,21,1,1/1/2020,3/1/2020,3/15/2020,Saturday,Spring,1
3/22/2020,2020,3,22,1,1/1/2020,3/1/2020,3/22/2020,Sunday,Spring,1
3/23/2020,2020,3,23,1,1/1/2020,3/1/2020,3/22/2020,Monday,Spring,0
3/24/2020,2020,3,24,1,1/1/2020,3/1/2020,3/22/2020,Tuesday,Spring,0
3/25/2020,2020,3,25,1,1/1/2020,3/1/2020,3/22/2020,Wednesday,Spring,0
3/26/2020,2020,3,26,1,1/1/2020,3/1/2020,3/22/2020,Thursday,Spring,0
3/27/2020,2020,3,27,1,1/1/2020,3/1/2020,3/22/2020,Friday,Spring,0
3/28/2020,2020,3,28,1,1/1/2020,3/1/2020,3/22/2020,Saturday,Spring,1
3/29/2020,2020,3,29,1,1/1/2020,3/1/2020,3/29/2020,Sunday,Spring,1
3/30/2020,2020,3,30,1,1/1/2020,3/1/2020,3/29/2020,Monday,Spring,0
3/31/2020,2020,3,31,1,1/1/2020,3/1/2020,3/29/2020,Tuesday,Spring,0
4/1/2020,2020,4,1,1,4/1/2020,4/1/2020,3/29/2020,Wednesday,Spring,0
4/2/2020,2020,4,2,1,4/1/2020,4/1/2020,3/29/2020,Thursday,Spring,0
4/3/2020,2020,4,3,1,4/1/2020,4/1/2020,3/29/2020,Friday,Spring,0
4/4/2020,2020,4,4,1,4/1/2020,4/1/2020,3/29/2020,Saturday,Spring,1
4/5/2020,2020,4,5,2,4/1/2020,4/1/2020,4/5/2020,Sunday,Spring,1
4/6/2020,2020,4,6,2,4/1/2020,4/1/2020,4/5/2020,Monday,Spring,0
4/7/2020,2020,4,7,2,4/1/2020,4/1/2020,4/5/2020,Tuesday,Spring,0
4/8/2020,2020,4,8,2,4/1/2020,4/1/2020,4/5/2020,Wednesday,Spring,0
4/9/2020,2020,4,9,2,4/1/2020,4/1/2020,4/5/2020,Thursday,Spring,0
4/10/2020,2020,4,10,2,4/1/2020,4/1/2020,4/5/2020,Friday,Spring,0
4/11/2020,2020,4,11,2,4/1/2020,4/1/2020,4/5/2020,Saturday,Spring,1
4/12/2020,2020,4,12,2,4/1/2020,4/1/2020,4/12/2020,Sunday,Spring,1
4/13/2020,2020,4,13,2,4/1/2020,4/1/2020,4/12/2020,Monday,Spring,0
4/14/2020,2020,4,14,2,4/1/2020,4/1/2020,4/12/2020,Tuesday,Spring,0
4/15/2020,2020,4,15,2,4/1/2020,4/1/2020,4/12/2020,Wednesday,Spring,0
4/16/2020,2020,4,16,2,4/1/2020,4/1/2020,4/12/2020,Thursday,Spring,0
4/17/2020,2020,4,17,2,4/1/2020,4/1/2020,4/12/2020,Friday,Spring,0
4/18/2020,2020,4,18,2,4/1/2020,4/1/2020,4/12/2020,Saturday,Spring,1
4/19/2020,2020,4,19,2,4/1/2020,4/1/2020,4/19/2020,Sunday,Spring,1
4/20/2020,2020,4,20,2,4/1/2020,4/1/2020,4/19/2020,Monday,Spring,0
4/21/2020,2020,4,21,2,4/1/2020,4/1/2020,4/19/2020,Tuesday,Spring,0
4/22/2020,2020,4,22,2,4/1/2020,4/1/2020,4/19/2020,Wednesday,Spring,0
4/23/2020,2020,4,23,2,4/1/2020,4/1/2020,4/19/2020,Thursday,Spring,0
4/24/2020,2020,4,24,2,4/1/2020,4/1/2020,4/19/2020,Friday,Spring,0
4/25/2020,2020,4,25,2,4/1/2020,4/1/2020,4/19/2020,Saturday,Spring,1
4/26/2020,2020,4,26,2,4/1/2020,4/1/2020,4/26/2020,Sunday,Spring,1
4/27/2020,2020,4,27,2,4/1/2020,4/1/2020,4/26/2020,Monday,Spring,0
4/28/2020,2020,4,28,2,4/1/2020,4/1/2020,4/26/2020,Tuesday,Spring,0
4/29/2020,2020,4,29,2,4/1/2020,4/1/2020,4/26/2020,Wednesday,Spring,0
4/30/2020,2020,4,30,2,4/1/2020,4/1/2020,4/26/2020,Thursday,Spring,0
5/1/2020,2020,5,1,2,4/1/2020,5/1/2020,4/26/2020,Friday,Spring,0
5/2/2020,2020,5,2,2,4/1/2020,5/1/2020,4/26/2020,Saturday,Spring,1
5/3/2020,2020,5,3,2,4/1/2020,5/1/2020,5/3/2020,Sunday,Spring,1
5/4/2020,2020,5,4,2,4/1/2020,5/1/2020,5/3/2020,Monday,Spring,0
5/5/2020,2020,5,5,2,4/1/2020,5/1/2020,5/3/2020,Tuesday,Spring,0
5/6/2020,2020,5,6,2,4/1/2020,5/1/2020,5/3/2020,Wednesday,Spring,0
5/7/2020,2020,5,7,2,4/1/2020,5/1/2020,5/3/2020,Thursday,Spring,0
5/8/2020,2020,5,8,2,4/1/2020,5/1/2020,5/3/2020,Friday,Spring,0
5/9/2020,2020,5,9,2,4/1/2020,5/1/2020,5/3/2020,Saturday,Spring,1
5/10/2020,2020,5,10,2,4/1/2020,5/1/2020,5/10/2020,Sunday,Spring,1
5/11/2020,2020,5,11,2,4/1/2020,5/1/2020,5/10/2020,Monday,Spring,0
5/12/2020,2020,5,12,2,4/1/2020,5/1/2020,5/10/2020,Tuesday,Spring,0
5/13/2020,2020,5,13,2,4/1/2020,5/1/2020,5/10/2020,Wednesday,Spring,0
5/14/2020,2020,5,14,2,4/1/2020,5/1/2020,5/10/2020,Thursday,Spring,0
5/15/2020,2020,5,15,2,4/1/2020,5/1/2020,5/10/2020,Friday,Spring,0
5/16/2020,2020,5,16,2,4/1/2020,5/1/2020,5/10/2020,Saturday,Spring,1
5/17/2020,2020,5,17,2,4/1/2020,5/1/2020,5/17/2020,Sunday,Spring,1
5/18/2020,2020,5,18,2,4/1/2020,5/1/2020,5/17/2020,Monday,Spring,0
5/19/2020,2020,5,19,2,4/1/2020,5/1/2020,5/17/2020,Tuesday,Spring,0
5/20/2020,2020,5,20,2,4/1/2020,5/1/2020,5/17/2020,Wednesday,Spring,0
5/21/2020,2020,5,21,2,4/1/2020,5/1/2020,5/17/2020,Thursday,Spring,0
5/22/2020,2020,5,22,2,4/1/2020,5/1/2020,5/17/2020,Friday,Spring,0
5/23/2020,2020,5,23,2,4/1/2020,5/1/2020,5/17/2020,Saturday,Spring,1
5/24/2020,2020,5,24,2,4/1/2020,5/1/2020,5/24/2020,Sunday,Spring,1
5/25/2020,2020,5,25,2,4/1/2020,5/1/2020,5/24/2020,Monday,Spring,0
5/26/2020,2020,5,26,2,4/1/2020,5/1/2020,5/24/2020,Tuesday,Spring,0
5/27/2020,2020,5,27,2,4/1/2020,5/1/2020,5/24/2020,Wednesday,Spring,0
5/28/2020,2020,5,28,2,4/1/2020,5/1/2020,5/24/2020,Thursday,Spring,0
5/29/2020,2020,5,29,2,4/1/2020,5/1/2020,5/24/2020,Friday,Spring,0
5/30/2020,2020,5,30,2,4/1/2020,5/1/2020,5/24/2020,Saturday,Spring,1
5/31/2020,2020,5,31,2,4/1/2020,5/1/2020,5/31/2020,Sunday,Spring,1
6/1/2020,2020,6,1,2,4/1/2020,6/1/2020,5/31/2020,Monday,Summer,0
6/2/2020,2020,6,2,2,4/1/2020,6/1/2020,5/31/2020,Tuesday,Summer,0
6/3/2020,2020,6,3,2,4/1/2020,6/1/2020,5/31/2020,Wednesday,Summer,0
6/4/2020,2020,6,4,2,4/1/2020,6/1/2020,5/31/2020,Thursday,Summer,0
6/5/2020,2020,6,5,2,4/1/2020,6/1/2020,5/31/2020,Friday,Summer,0
6/6/2020,2020,6,6,2,4/1/2020,6/1/2020,5/31/2020,Saturday,Summer,1
6/7/2020,2020,6,7,2,4/1/2020,6/1/2020,6/7/2020,Sunday,Summer,1
6/8/2020,2020,6,8,2,4/1/2020,6/1/2020,6/7/2020,Monday,Summer,0
6/9/2020,2020,6,9,2,4/1/2020,6/1/2020,6/7/2020,Tuesday,Summer,0
6/10/2020,2020,6,10,2,4/1/2020,6/1/2020,6/7/2020,Wednesday,Summer,0
6/11/2020,2020,6,11,2,4/1/2020,6/1/2020,6/7/2020,Thursday,Summer,0
6/12/2020,2020,6,12,2,4/1/2020,6/1/2020,6/7/2020,Friday,Summer,0
6/13/2020,2020,6,13,2,4/1/2020,6/1/2020,6/7/2020,Saturday,Summer,1
6/14/2020,2020,6,14,2,4/1/2020,6/1/2020,6/14/2020,Sunday,Summer,1
6/15/2020,2020,6,15,2,4/1/2020,6/1/2020,6/14/2020,Monday,Summer,0
6/16/2020,2020,6,16,2,4/1/2020,6/1/2020,6/14/2020,Tuesday,Summer,0
6/17/2020,2020,6,17,2,4/1/2020,6/1/2020,6/14/2020,Wednesday,Summer,0
6/18/2020,2020,6,18,2,4/1/2020,6/1/2020,6/14/2020,Thursday,Summer,0
6/19/2020,2020,6,19,2,4/1/2020,6/1/2020,6/14/2020,Friday,Summer,0
6/20/2020,2020,6,20,2,4/1/2020,6/1/2020,6/14/2020,Saturday,Summer,1
6/21/2020,2020,6,21,2,4/1/2020,6/1/2020,6/21/2020,Sunday,Summer,1
6/22/2020,2020,6,22,2,4/1/2020,6/1/2020,6/21/2020,Monday,Summer,0
6/23/2020,2020,6,23,2,4/1/2020,6/1/2020,6/21/2020,Tuesday,Summer,0
6/24/2020,2020,6,24,2,4/1/2020,6/1/2020,6/21/2020,Wednesday,Summer,0
6/25/2020,2020,6,25,2,4/1/2020,6/1/2020,6/21/2020,Thursday,Summer,0
6/26/2020,2020,6,26,2,4/1/2020,6/1/2020,6/21/2020,Friday,Summer,0
6/27/2020,2020,6,27,2,4/1/2020,6/1/2020,6/21/2020,Saturday,Summer,1
6/28/2020,2020,6,28,2,4/1/2020,6/1/2020,6/28/2020,Sunday,Summer,1
6/29/2020,2020,6,29,2,4/1/2020,6/1/2020,6/28/2020,Monday,Summer,0
6/30/2020,2020,6,30,2,4/1/2020,6/1/2020,6/28/2020,Tuesday,Summer,0
7/1/2020,2020,7,1,2,7/1/2020,7/1/2020,6/28/2020,Wednesday,Summer,0
7/2/2020,2020,7,2,2,7/1/2020,7/1/2020,6/28/2020,Thursday,Summer,0
7/3/2020,2020,7,3,2,7/1/2020,7/1/2020,6/28/2020,Friday,Summer,0
7/4/2020,2020,7,4,2,7/1/2020,7/1/2020,6/28/2020,Saturday,Summer,1
7/5/2020,2020,7,5,3,7/1/2020,7/1/2020,7/5/2020,Sunday,Summer,1
7/6/2020,2020,7,6,3,7/1/2020,7/1/2020,7/5/2020,Monday,Summer,0
7/7/2020,2020,7,7,3,7/1/2020,7/1/2020,7/5/2020,Tuesday,Summer,0
7/8/2020,2020,7,8,3,7/1/2020,7/1/2020,7/5/2020,Wednesday,Summer,0
7/9/2020,2020,7,9,3,7/1/2020,7/1/2020,7/5/2020,Thursday,Summer,0
7/10/2020,2020,7,10,3,7/1/2020,7/1/2020,7/5/2020,Friday,Summer,0
7/11/2020,2020,7,11,3,7/1/2020,7/1/2020,7/5/2020,Saturday,Summer,1
7/12/2020,2020,7,12,3,7/1/2020,7/1/2020,7/12/2020,Sunday,Summer,1
7/13/2020,2020,7,13,3,7/1/2020,7/1/2020,7/12/2020,Monday,Summer,0
7/14/2020,2020,7,14,3,7/1/2020,7/1/2020,7/12/2020,Tuesday,Summer,0
7/15/2020,2020,7,15,3,7/1/2020,7/1/2020,7/12/2020,Wednesday,Summer,0
7/16/2020,2020,7,16,3,7/1/2020,7/1/2020,7/12/2020,Thursday,Summer,0
7/17/2020,2020,7,17,3,7/1/2020,7/1/2020,7/12/2020,Friday,Summer,0
7/18/2020,2020,7,18,3,7/1/2020,7/1/2020,7/12/2020,Saturday,Summer,1
7/19/2020,2020,7,19,3,7/1/2020,7/1/2020,7/19/2020,Sunday,Summer,1
7/20/2020,2020,7,20,3,7/1/2020,7/1/2020,7/19/2020,Monday,Summer,0
7/21/2020,2020,7,21,3,7/1/2020,7/1/2020,7/19/2020,Tuesday,Summer,0
7/22/2020,2020,7,22,3,7/1/2020,7/1/2020,7/19/2020,Wednesday,Summer,0
7/23/2020,2020,7,23,3,7/1/2020,7/1/2020,7/19/2020,Thursday,Summer,0
7/24/2020,2020,7,24,3,7/1/2020,7/1/2020,7/19/2020,Friday,Summer,0
7/25/2020,2020,7,25,3,7/1/2020,7/1/2020,7/19/2020,Saturday,Summer,1
7/26/2020,2020,7,26,3,7/1/2020,7/1/2020,7/26/2020,Sunday,Summer,1
7/27/2020,2020,7,27,3,7/1/2020,7/1/2020,7/26/2020,Monday,Summer,0
7/28/2020,2020,7,28,3,7/1/2020,7/1/2020,7/26/2020,Tuesday,Summer,0
7/29/2020,2020,7,29,3,7/1/2020,7/1/2020,7/26/2020,Wednesday,Summer,0
7/30/2020,2020,7,30,3,7/1/2020,7/1/2020,7/26/2020,Thursday,Summer,0
7/31/2020,2020,7,31,3,7/1/2020,7/1/2020,7/26/2020,Friday,Summer,0
8/1/2020,2020,8,1,3,7/1/2020,8/1/2020,7/26/2020,Saturday,Summer,1
8/2/2020,2020,8,2,3,7/1/2020,8/1/2020,8/2/2020,Sunday,Summer,1
8/3/2020,2020,8,3,3,7/1/2020,8/1/2020,8/2/2020,Monday,Summer,0
8/4/2020,2020,8,4,3,7/1/2020,8/1/2020,8/2/2020,Tuesday,Summer,0
8/5/2020,2020,8,5,3,7/1/2020,8/1/2020,8/2/2020,Wednesday,Summer,0
8/6/2020,2020,8,6,3,7/1/2020,8/1/2020,8/2/2020,Thursday,Summer,0
8/7/2020,2020,8,7,3,7/1/2020,8/1/2020,8/2/2020,Friday,Summer,0
8/8/2020,2020,8,8,3,7/1/2020,8/1/2020,8/2/2020,Saturday,Summer,1
8/9/2020,2020,8,9,3,7/1/2020,8/1/2020,8/9/2020,Sunday,Summer,1
8/10/2020,2020,8,10,3,7/1/2020,8/1/2020,8/9/2020,Monday,Summer,0
8/11/2020,2020,8,11,3,7/1/2020,8/1/2020,8/9/2020,Tuesday,Summer,0
8/12/2020,2020,8,12,3,7/1/2020,8/1/2020,8/9/2020,Wednesday,Summer,0
8/13/2020,2020,8,13,3,7/1/2020,8/1/2020,8/9/2020,Thursday,Summer,0
8/14/2020,2020,8,14,3,7/1/2020,8/1/2020,8/9/2020,Friday,Summer,0
8/15/2020,2020,8,15,3,7/1/2020,8/1/2020,8/9/2020,Saturday,Summer,1
8/16/2020,2020,8,16,3,7/1/2020,8/1/2020,8/16/2020,Sunday,Summer,1
8/17/2020,2020,8,17,3,7/1/2020,8/1/2020,8/16/2020,Monday,Summer,0
8/18/2020,2020,8,18,3,7/1/2020,8/1/2020,8/16/2020,Tuesday,Summer,0
8/19/2020,2020,8,19,3,7/1/2020,8/1/2020,8/16/2020,Wednesday,Summer,0
8/20/2020,2020,8,20,3,7/1/2020,8/1/2020,8/16/2020,Thursday,Summer,0
8/21/2020,2020,8,21,3,7/1/2020,8/1/2020,8/16/2020,Friday,Summer,0
8/22/2020,2020,8,22,3,7/1/2020,8/1/2020,8/16/2020,Saturday,Summer,1
8/23/2020,2020,8,23,3,7/1/2020,8/1/2020,8/23/2020,Sunday,Summer,1
8/24/2020,2020,8,24,3,7/1/2020,8/1/2020,8/23/2020,Monday,Summer,0
8/25/2020,2020,8,25,3,7/1/2020,8/1/2020,8/23/2020,Tuesday,Summer,0
8/26/2020,2020,8,26,3,7/1/2020,8/1/2020,8/23/2020,Wednesday,Summer,0
8/27/2020,2020,8,27,3,7/1/2020,8/1/2020,8/23/2020,Thursday,Summer,0
8/28/2020,2020,8,28,3,7/1/2020,8/1/2020,8/23/2020,Friday,Summer,0
8/29/2020,2020,8,29,3,7/1/2020,8/1/2020,8/23/2020,Saturday,Summer,1
8/30/2020,2020,8,30,3,7/1/2020,8/1/2020,8/30/2020,Sunday,Summer,1
8/31/2020,2020,8,31,3,7/1/2020,8/1/2020,8/30/2020,Monday,Summer,0
9/1/2020,2020,9,1,3,7/1/2020,9/1/2020,8/30/2020,Tuesday,Fall,0
9/2/2020,2020,9,2,3,7/1/2020,9/1/2020,8/30/2020,Wednesday,Fall,0
9/3/2020,2020,9,3,3,7/1/2020,9/1/2020,8/30/2020,Thursday,Fall,0
9/4/2020,2020,9,4,3,7/1/2020,9/1/2020,8/30/2020,Friday,Fall,0
9/5/2020,2020,9,5,3,7/1/2020,9/1/2020,8/30/2020,Saturday,Fall,1
9/6/2020,2020,9,6,3,7/1/2020,9/1/2020,9/6/2020,Sunday,Fall,1
9/7/2020,2020,9,7,3,7/1/2020,9/1/2020,9/6/2020,Monday,Fall,0
9/8/2020,2020,9,8,3,7/1/2020,9/1/2020,9/6/2020,Tuesday,Fall,0
9/9/2020,2020,9,9,3,7/1/2020,9/1/2020,9/6/2020,Wednesday,Fall,0
9/10/2020,2020,9,10,3,7/1/2020,9/1/2020,9/6/2020,Thursday,Fall,0
9/11/2020,2020,9,11,3,7/1/2020,9/1/2020,9/6/2020,Friday,Fall,0
9/12/2020,2020,9,12,3,7/1/2020,9/1/2020,9/6/2020,Saturday,Fall,1
9/13/2020,2020,9,13,3,7/1/2020,9/1/2020,9/13/2020,Sunday,Fall,1
9/14/2020,2020,9,14,3,7/1/2020,9/1/2020,9/13/2020,Monday,Fall,0
9/15/2020,2020,9,15,3,7/1/2020,9/1/2020,9/13/2020,Tuesday,Fall,0
9/16/2020,2020,9,16,3,7/1/2020,9/1/2020,9/13/2020,Wednesday,Fall,0
9/17/2020,2020,9,17,3,7/1/2020,9/1/2020,9/13/2020,Thursday,Fall,0
9/18/2020,2020,9,18,3,7/1/2020,9/1/2020,9/13/2020,Friday,Fall,0
9/19/2020,2020,9,19,3,7/1/2020,9/1/2020,9/13/2020,Saturday,Fall,1
9/20/2020,2020,9,20,3,7/1/2020,9/1/2020,9/20/2020,Sunday,Fall,1
9/21/2020,2020,9,21,3,7/1/2020,9/1/2020,9/20/2020,Monday,Fall,0
9/22/2020,2020,9,22,3,7/1/2020,9/1/2020,9/20/2020,Tuesday,Fall,0
9/23/2020,2020,9,23,3,7/1/2020,9/1/2020,9/20/2020,Wednesday,Fall,0
9/24/2020,2020,9,24,3,7/1/2020,9/1/2020,9/20/2020,Thursday,Fall,0
9/25/2020,2020,9,25,3,7/1/2020,9/1/2020,9/20/2020,Friday,Fall,0
9/26/2020,2020,9,26,3,7/1/2020,9/1/2020,9/20/2020,Saturday,Fall,1
9/27/2020,2020,9,27,3,7/1/2020,9/1/2020,9/27/2020,Sunday,Fall,1
9/28/2020,2020,9,28,3,7/1/2020,9/1/2020,9/27/2020,Monday,Fall,0
9/29/2020,2020,9,29,3,7/1/2020,9/1/2020,9/27/2020,Tuesday,Fall,0
9/30/2020,2020,9,30,3,7/1/2020,9/1/2020,9/27/2020,Wednesday,Fall,0
10/1/2020,2020,10,1,3,10/1/2020,10/1/2020,9/27/2020,Thursday,Fall,0
10/2/2020,2020,10,2,3,10/1/2020,10/1/2020,9/27/2020,Friday,Fall,0
10/3/2020,2020,10,3,3,10/1/2020,10/1/2020,9/27/2020,Saturday,Fall,1
10/4/2020,2020,10,4,4,10/1/2020,10/1/2020,10/4/2020,Sunday,Fall,1
10/5/2020,2020,10,5,4,10/1/2020,10/1/2020,10/4/2020,Monday,Fall,0
10/6/2020,2020,10,6,4,10/1/2020,10/1/2020,10/4/2020,Tuesday,Fall,0
10/7/2020,2020,10,7,4,10/1/2020,10/1/2020,10/4/2020,Wednesday,Fall,0
10/8/2020,2020,10,8,4,10/1/2020,10/1/2020,10/4/2020,Thursday,Fall,0
10/9/2020,2020,10,9,4,10/1/2020,10/1/2020,10/4/2020,Friday,Fall,0
10/10/2020,2020,10,10,4,10/1/2020,10/1/2020,10/4/2020,Saturday,Fall,1
10/11/2020,2020,10,11,4,10/1/2020,10/1/2020,10/11/2020,Sunday,Fall,1
10/12/2020,2020,10,12,4,10/1/2020,10/1/2020,10/11/2020,Monday,Fall,0
10/13/2020,2020,10,13,4,10/1/2020,10/1/2020,10/11/2020,Tuesday,Fall,0
10/14/2020,2020,10,14,4,10/1/2020,10/1/2020,10/11/2020,Wednesday,Fall,0
10/15/2020,2020,10,15,4,10/1/2020,10/1/2020,10/11/2020,Thursday,Fall,0
10/16/2020,2020,10,16,4,10/1/2020,10/1/2020,10/11/2020,Friday,Fall,0
10/17/2020,2020,10,17,4,10/1/2020,10/1/2020,10/11/2020,Saturday,Fall,1
10/18/2020,2020,10,18,4,10/1/2020,10/1/2020,10/18/2020,Sunday,Fall,1
10/19/2020,2020,10,19,4,10/1/2020,10/1/2020,10/18/2020,Monday,Fall,0
10/20/2020,2020,10,20,4,10/1/2020,10/1/2020,10/18/2020,Tuesday,Fall,0
10/21/2020,2020,10,21,4,10/1/2020,10/1/2020,10/18/2020,Wednesday,Fall,0
10/22/2020,2020,10,22,4,10/1/2020,10/1/2020,10/18/2020,Thursday,Fall,0
10/23/2020,2020,10,23,4,10/1/2020,10/1/2020,10/18/2020,Friday,Fall,0
10/24/2020,2020,10,24,4,10/1/2020,10/1/2020,10/18/2020,Saturday,Fall,1
10/25/2020,2020,10,25,4,10/1/2020,10/1/2020,10/25/2020,Sunday,Fall,1
10/26/2020,2020,10,26,4,10/1/2020,10/1/2020,10/25/2020,Monday,Fall,0
10/27/2020,2020,10,27,4,10/1/2020,10/1/2020,10/25/2020,Tuesday,Fall,0
10/28/2020,2020,10,28,4,10/1/2020,10/1/2020,10/25/2020,Wednesday,Fall,0
10/29/2020,2020,10,29,4,10/1/2020,10/1/2020,10/25/2020,Thursday,Fall,0
10/30/2020,2020,10,30,4,10/1/2020,10/1/2020,10/25/2020,Friday,Fall,0
10/31/2020,2020,10,31,4,10/1/2020,10/1/2020,10/25/2020,Saturday,Fall,1
11/1/2020,2020,11,1,4,10/1/2020,11/1/2020,11/1/2020,Sunday,Fall,1
11/2/2020,2020,11,2,4,10/1/2020,11/1/2020,11/1/2020,Monday,Fall,0
11/3/2020,2020,11,3,4,10/1/2020,11/1/2020,11/1/2020,Tuesday,Fall,0
11/4/2020,2020,11,4,4,10/1/2020,11/1/2020,11/1/2020,Wednesday,Fall,0
11/5/2020,2020,11,5,4,10/1/2020,11/1/2020,11/1/2020,Thursday,Fall,0
11/6/2020,2020,11,6,4,10/1/2020,11/1/2020,11/1/2020,Friday,Fall,0
11/7/2020,2020,11,7,4,10/1/2020,11/1/2020,11/1/2020,Saturday,Fall,1
11/8/2020,2020,11,8,4,10/1/2020,11/1/2020,11/8/2020,Sunday,Fall,1
11/9/2020,2020,11,9,4,10/1/2020,11/1/2020,11/8/2020,Monday,Fall,0
11/10/2020,2020,11,10,4,10/1/2020,11/1/2020,11/8/2020,Tuesday,Fall,0
11/11/2020,2020,11,11,4,10/1/2020,11/1/2020,11/8/2020,Wednesday,Fall,0
11/12/2020,2020,11,12,4,10/1/2020,11/1/2020,11/8/2020,Thursday,Fall,0
11/13/2020,2020,11,13,4,10/1/2020,11/1/2020,11/8/2020,Friday,Fall,0
11/14/2020,2020,11,14,4,10/1/2020,11/1/2020,11/8/2020,Saturday,Fall,1
11/15/2020,2020,11,15,4,10/1/2020,11/1/2020,11/15/2020,Sunday,Fall,1
11/16/2020,2020,11,16,4,10/1/2020,11/1/2020,11/15/2020,Monday,Fall,0
11/17/2020,2020,11,17,4,10/1/2020,11/1/2020,11/15/2020,Tuesday,Fall,0
11/18/2020,2020,11,18,4,10/1/2020,11/1/2020,11/15/2020,Wednesday,Fall,0
11/19/2020,2020,11,19,4,10/1/2020,11/1/2020,11/15/2020,Thursday,Fall,0
11/20/2020,2020,11,20,4,10/1/2020,11/1/2020,11/15/2020,Friday,Fall,0
11/21/2020,2020,11,21,4,10/1/2020,11/1/2020,11/15/2020,Saturday,Fall,1
11/22/2020,2020,11,22,4,10/1/2020,11/1/2020,11/22/2020,Sunday,Fall,1
11/23/2020,2020,11,23,4,10/1/2020,11/1/2020,11/22/2020,Monday,Fall,0
11/24/2020,2020,11,24,4,10/1/2020,11/1/2020,11/22/2020,Tuesday,Fall,0
11/25/2020,2020,11,25,4,10/1/2020,11/1/2020,11/22/2020,Wednesday,Fall,0
11/26/2020,2020,11,26,4,10/1/2020,11/1/2020,11/22/2020,Thursday,Fall,0
11/27/2020,2020,11,27,4,10/1/2020,11/1/2020,11/22/2020,Friday,Fall,0
11/28/2020,2020,11,28,4,10/1/2020,11/1/2020,11/22/2020,Saturday,Fall,1
11/29/2020,2020,11,29,4,10/1/2020,11/1/2020,11/29/2020,Sunday,Fall,1
11/30/2020,2020,11,30,4,10/1/2020,11/1/2020,11/29/2020,Monday,Fall,0
12/1/2020,2020,12,1,4,10/1/2020,12/1/2020,11/29/2020,Tuesday,Winter,0
12/2/2020,2020,12,2,4,10/1/2020,12/1/2020,11/29/2020,Wednesday,Winter,0
12/3/2020,2020,12,3,4,10/1/2020,12/1/2020,11/29/2020,Thursday,Winter,0
12/4/2020,2020,12,4,4,10/1/2020,12/1/2020,11/29/2020,Friday,Winter,0
12/5/2020,2020,12,5,4,10/1/2020,12/1/2020,11/29/2020,Saturday,Winter,1
12/6/2020,2020,12,6,4,10/1/2020,12/1/2020,12/6/2020,Sunday,Winter,1
12/7/2020,2020,12,7,4,10/1/2020,12/1/2020,12/6/2020,Monday,Winter,0
12/8/2020,2020,12,8,4,10/1/2020,12/1/2020,12/6/2020,Tuesday,Winter,0
12/9/2020,2020,12,9,4,10/1/2020,12/1/2020,12/6/2020,Wednesday,Winter,0
12/10/2020,2020,12,10,4,10/1/2020,12/1/2020,12/6/2020,Thursday,Winter,0
12/11/2020,2020,12,11,4,10/1/2020,12/1/2020,12/6/2020,Friday,Winter,0
12/12/2020,2020,12,12,4,10/1/2020,12/1/2020,12/6/2020,Saturday,Winter,1
12/13/2020,2020,12,13,4,10/1/2020,12/1/2020,12/13/2020,Sunday,Winter,1
12/14/2020,2020,12,14,4,10/1/2020,12/1/2020,12/13/2020,Monday,Winter,0
12/15/2020,2020,12,15,4,10/1/2020,12/1/2020,12/13/2020,Tuesday,Winter,0
12/16/2020,2020,12,16,4,10/1/2020,12/1/2020,12/13/2020,Wednesday,Winter,0
12/17/2020,2020,12,17,4,10/1/2020,12/1/2020,12/13/2020,Thursday,Winter,0
12/18/2020,2020,12,18,4,10/1/2020,12/1/2020,12/13/2020,Friday,Winter,0
12/19/2020,2020,12,19,4,10/1/2020,12/1/2020,12/13/2020,Saturday,Winter,1
12/20/2020,2020,12,20,4,10/1/2020,12/1/2020,12/20/2020,Sunday,Winter,1
12/21/2020,2020,12,21,4,10/1/2020,12/1/2020,12/20/2020,Monday,Winter,0
12/22/2020,2020,12,22,4,10/1/2020,12/1/2020,12/20/2020,Tuesday,Winter,0
12/23/2020,2020,12,23,4,10/1/2020,12/1/2020,12/20/2020,Wednesday,Winter,0
12/24/2020,2020,12,24,4,10/1/2020,12/1/2020,12/20/2020,Thursday,Winter,0
12/25/2020,2020,12,25,4,10/1/2020,12/1/2020,12/20/2020,Friday,Winter,0
12/26/2020,2020,12,26,4,10/1/2020,12/1/2020,12/20/2020,Saturday,Winter,1
12/27/2020,2020,12,27,4,10/1/2020,12/1/2020,12/27/2020,Sunday,Winter,1
12/28/2020,2020,12,28,4,10/1/2020,12/1/2020,12/27/2020,Monday,Winter,0
12/29/2020,2020,12,29,4,10/1/2020,12/1/2020,12/27/2020,Tuesday,Winter,0
12/30/2020,2020,12,30,4,10/1/2020,12/1/2020,12/27/2020,Wednesday,Winter,0
12/31/2020,2020,12,31,4,10/1/2020,12/1/2020,12/27/2020,Thursday,Winter,0
1/1/2021,2021,1,1,4,1/1/2021,1/1/2021,12/27/2020,Friday,Winter,0
1/2/2021,2021,1,2,4,1/1/2021,1/1/2021,12/27/2020,Saturday,Winter,1
1/3/2021,2021,1,3,1,1/1/2021,1/1/2021,1/3/2021,Sunday,Winter,1
1/4/2021,2021,1,4,1,1/1/2021,1/1/2021,1/3/2021,Monday,Winter,0
1/5/2021,2021,1,5,1,1/1/2021,1/1/2021,1/3/2021,Tuesday,Winter,0
1/6/2021,2021,1,6,1,1/1/2021,1/1/2021,1/3/2021,Wednesday,Winter,0
1/7/2021,2021,1,7,1,1/1/2021,1/1/2021,1/3/2021,Thursday,Winter,0
1/8/2021,2021,1,8,1,1/1/2021,1/1/2021,1/3/2021,Friday,Winter,0
1/9/2021,2021,1,9,1,1/1/2021,1/1/2021,1/3/2021,Saturday,Winter,1
1/10/2021,2021,1,10,1,1/1/2021,1/1/2021,1/10/2021,Sunday,Winter,1
1/11/2021,2021,1,11,1,1/1/2021,1/1/2021,1/10/2021,Monday,Winter,0
1/12/2021,2021,1,12,1,1/1/2021,1/1/2021,1/10/2021,Tuesday,Winter,0
1/13/2021,2021,1,13,1,1/1/2021,1/1/2021,1/10/2021,Wednesday,Winter,0
1/14/2021,2021,1,14,1,1/1/2021,1/1/2021,1/10/2021,Thursday,Winter,0
1/15/2021,2021,1,15,1,1/1/2021,1/1/2021,1/10/2021,Friday,Winter,0
1/16/2021,2021,1,16,1,1/1/2021,1/1/2021,1/10/2021,Saturday,Winter,1
1/17/2021,2021,1,17,1,1/1/2021,1/1/2021,1/17/2021,Sunday,Winter,1
1/18/2021,2021,1,18,1,1/1/2021,1/1/2021,1/17/2021,Monday,Winter,0
1/19/2021,2021,1,19,1,1/1/2021,1/1/2021,1/17/2021,Tuesday,Winter,0
1/20/2021,2021,1,20,1,1/1/2021,1/1/2021,1/17/2021,Wednesday,Winter,0
1/21/2021,2021,1,21,1,1/1/2021,1/1/2021,1/17/2021,Thursday,Winter,0
1/22/2021,2021,1,22,1,1/1/2021,1/1/2021,1/17/2021,Friday,Winter,0
1/23/2021,2021,1,23,1,1/1/2021,1/1/2021,1/17/2021,Saturday,Winter,1
1/24/2021,2021,1,24,1,1/1/2021,1/1/2021,1/24/2021,Sunday,Winter,1
1/25/2021,2021,1,25,1,1/1/2021,1/1/2021,1/24/2021,Monday,Winter,0
1/26/2021,2021,1,26,1,1/1/2021,1/1/2021,1/24/2021,Tuesday,Winter,0
1/27/2021,2021,1,27,1,1/1/2021,1/1/2021,1/24/2021,Wednesday,Winter,0
1/28/2021,2021,1,28,1,1/1/2021,1/1/2021,1/24/2021,Thursday,Winter,0
1/29/2021,2021,1,29,1,1/1/2021,1/1/2021,1/24/2021,Friday,Winter,0
1/30/2021,2021,1,30,1,1/1/2021,1/1/2021,1/24/2021,Saturday,Winter,1
1/31/2021,2021,1,31,1,1/1/2021,1/1/2021,1/31/2021,Sunday,Winter,1
2/1/2021,2021,2,1,1,1/1/2021,2/1/2021,1/31/2021,Monday,Winter,0
2/2/2021,2021,2,2,1,1/1/2021,2/1/2021,1/31/2021,Tuesday,Winter,0
2/3/2021,2021,2,3,1,1/1/2021,2/1/2021,1/31/2021,Wednesday,Winter,0
2/4/2021,2021,2,4,1,1/1/2021,2/1/2021,1/31/2021,Thursday,Winter,0
2/5/2021,2021,2,5,1,1/1/2021,2/1/2021,1/31/2021,Friday,Winter,0
2/6/2021,2021,2,6,1,1/1/2021,2/1/2021,1/31/2021,Saturday,Winter,1
2/7/2021,2021,2,7,1,1/1/2021,2/1/2021,2/7/2021,Sunday,Winter,1
2/8/2021,2021,2,8,1,1/1/2021,2/1/2021,2/7/2021,Monday,Winter,0
2/9/2021,2021,2,9,1,1/1/2021,2/1/2021,2/7/2021,Tuesday,Winter,0
2/10/2021,2021,2,10,1,1/1/2021,2/1/2021,2/7/2021,Wednesday,Winter,0
2/11/2021,2021,2,11,1,1/1/2021,2/1/2021,2/7/2021,Thursday,Winter,0
2/12/2021,2021,2,12,1,1/1/2021,2/1/2021,2/7/2021,Friday,Winter,0
2/13/2021,2021,2,13,1,1/1/2021,2/1/2021,2/7/2021,Saturday,Winter,1
2/14/2021,2021,2,14,1,1/1/2021,2/1/2021,2/14/2021,Sunday,Winter,1
2/15/2021,2021,2,15,1,1/1/2021,2/1/2021,2/14/2021,Monday,Winter,0
2/16/2021,2021,2,16,1,1/1/2021,2/1/2021,2/14/2021,Tuesday,Winter,0
2/17/2021,2021,2,17,1,1/1/2021,2/1/2021,2/14/2021,Wednesday,Winter,0
2/18/2021,2021,2,18,1,1/1/2021,2/1/2021,2/14/2021,Thursday,Winter,0
2/19/2021,2021,2,19,1,1/1/2021,2/1/2021,2/14/2021,Friday,Winter,0
2/20/2021,2021,2,20,1,1/1/2021,2/1/2021,2/14/2021,Saturday,Winter,1
2/21/2021,2021,2,21,1,1/1/2021,2/1/2021,2/21/2021,Sunday,Winter,1
2/22/2021,2021,2,22,1,1/1/2021,2/1/2021,2/21/2021,Monday,Winter,0
2/23/2021,2021,2,23,1,1/1/2021,2/1/2021,2/21/2021,Tuesday,Winter,0
2/24/2021,2021,2,24,1,1/1/2021,2/1/2021,2/21/2021,Wednesday,Winter,0
2/25/2021,2021,2,25,1,1/1/2021,2/1/2021,2/21/2021,Thursday,Winter,0
2/26/2021,2021,2,26,1,1/1/2021,2/1/2021,2/21/2021,Friday,Winter,0
2/27/2021,2021,2,27,1,1/1/2021,2/1/2021,2/21/2021,Saturday,Winter,1
2/28/2021,2021,2,28,1,1/1/2021,2/1/2021,2/28/2021,Sunday,Winter,1
3/1/2021,2021,3,1,1,1/1/2021,3/1/2021,2/28/2021,Monday,Spring,0
3/2/2021,2021,3,2,1,1/1/2021,3/1/2021,2/28/2021,Tuesday,Spring,0
3/3/2021,2021,3,3,1,1/1/2021,3/1/2021,2/28/2021,Wednesday,Spring,0
3/4/2021,2021,3,4,1,1/1/2021,3/1/2021,2/28/2021,Thursday,Spring,0
3/5/2021,2021,3,5,1,1/1/2021,3/1/2021,2/28/2021,Friday,Spring,0
3/6/2021,2021,3,6,1,1/1/2021,3/1/2021,2/28/2021,Saturday,Spring,1
3/7/2021,2021,3,7,1,1/1/2021,3/1/2021,3/7/2021,Sunday,Spring,1
3/8/2021,2021,3,8,1,1/1/2021,3/1/2021,3/7/2021,Monday,Spring,0
3/9/2021,2021,3,9,1,1/1/2021,3/1/2021,3/7/2021,Tuesday,Spring,0
3/10/2021,2021,3,10,1,1/1/2021,3/1/2021,3/7/2021,Wednesday,Spring,0
3/11/2021,2021,3,11,1,1/1/2021,3/1/2021,3/7/2021,Thursday,Spring,0
3/12/2021,2021,3,12,1,1/1/2021,3/1/2021,3/7/2021,Friday,Spring,0
3/13/2021,2021,3,13,1,1/1/2021,3/1/2021,3/7/2021,Saturday,Spring,1
3/14/2021,2021,3,14,1,1/1/2021,3/1/2021,3/14/2021,Sunday,Spring,1
3/15/2021,2021,3,15,1,1/1/2021,3/1/2021,3/14/2021,Monday,Spring,0
3/16/2021,2021,3,16,1,1/1/2021,3/1/2021,3/14/2021,Tuesday,Spring,0
3/17/2021,2021,3,17,1,1/1/2021,3/1/2021,3/14/2021,Wednesday,Spring,0
3/18/2021,2021,3,18,1,1/1/2021,3/1/2021,3/14/2021,Thursday,Spring,0
3/19/2021,2021,3,19,1,1/1/2021,3/1/2021,3/14/2021,Friday,Spring,0
3/20/2021,2021,3,20,1,1/1/2021,3/1/2021,3/14/2021,Saturday,Spring,1
3/21/2021,2021,3,21,1,1/1/2021,3/1/2021,3/21/2021,Sunday,Spring,1
3/22/2021,2021,3,22,1,1/1/2021,3/1/2021,3/21/2021,Monday,Spring,0
3/23/2021,2021,3,23,1,1/1/2021,3/1/2021,3/21/2021,Tuesday,Spring,0
3/24/2021,2021,3,24,1,1/1/2021,3/1/2021,3/21/2021,Wednesday,Spring,0
3/25/2021,2021,3,25,1,1/1/2021,3/1/2021,3/21/2021,Thursday,Spring,0
3/26/2021,2021,3,26,1,1/1/2021,3/1/2021,3/21/2021,Friday,Spring,0
3/27/2021,2021,3,27,1,1/1/2021,3/1/2021,3/21/2021,Saturday,Spring,1
3/28/2021,2021,3,28,1,1/1/2021,3/1/2021,3/28/2021,Sunday,Spring,1
3/29/2021,2021,3,29,1,1/1/2021,3/1/2021,3/28/2021,Monday,Spring,0
3/30/2021,2021,3,30,1,1/1/2021,3/1/2021,3/28/2021,Tuesday,Spring,0
3/31/2021,2021,3,31,1,1/1/2021,3/1/2021,3/28/2021,Wednesday,Spring,0
4/1/2021,2021,4,1,1,4/1/2021,4/1/2021,3/28/2021,Thursday,Spring,0
4/2/2021,2021,4,2,1,4/1/2021,4/1/2021,3/28/2021,Friday,Spring,0
4/3/2021,2021,4,3,1,4/1/2021,4/1/2021,3/28/2021,Saturday,Spring,1
4/4/2021,2021,4,4,2,4/1/2021,4/1/2021,4/4/2021,Sunday,Spring,1
4/5/2021,2021,4,5,2,4/1/2021,4/1/2021,4/4/2021,Monday,Spring,0
4/6/2021,2021,4,6,2,4/1/2021,4/1/2021,4/4/2021,Tuesday,Spring,0
4/7/2021,2021,4,7,2,4/1/2021,4/1/2021,4/4/2021,Wednesday,Spring,0
4/8/2021,2021,4,8,2,4/1/2021,4/1/2021,4/4/2021,Thursday,Spring,0
4/9/2021,2021,4,9,2,4/1/2021,4/1/2021,4/4/2021,Friday,Spring,0
4/10/2021,2021,4,10,2,4/1/2021,4/1/2021,4/4/2021,Saturday,Spring,1
4/11/2021,2021,4,11,2,4/1/2021,4/1/2021,4/11/2021,Sunday,Spring,1
4/12/2021,2021,4,12,2,4/1/2021,4/1/2021,4/11/2021,Monday,Spring,0
4/13/2021,2021,4,13,2,4/1/2021,4/1/2021,4/11/2021,Tuesday,Spring,0
4/14/2021,2021,4,14,2,4/1/2021,4/1/2021,4/11/2021,Wednesday,Spring,0
4/15/2021,2021,4,15,2,4/1/2021,4/1/2021,4/11/2021,Thursday,Spring,0
4/16/2021,2021,4,16,2,4/1/2021,4/1/2021,4/11/2021,Friday,Spring,0
4/17/2021,2021,4,17,2,4/1/2021,4/1/2021,4/11/2021,Saturday,Spring,1
4/18/2021,2021,4,18,2,4/1/2021,4/1/2021,4/18/2021,Sunday,Spring,1
4/19/2021,2021,4,19,2,4/1/2021,4/1/2021,4/18/2021,Monday,Spring,0
4/20/2021,2021,4,20,2,4/1/2021,4/1/2021,4/18/2021,Tuesday,Spring,0
4/21/2021,2021,4,21,2,4/1/2021,4/1/2021,4/18/2021,Wednesday,Spring,0
4/22/2021,2021,4,22,2,4/1/2021,4/1/2021,4/18/2021,Thursday,Spring,0
4/23/2021,2021,4,23,2,4/1/2021,4/1/2021,4/18/2021,Friday,Spring,0
4/24/2021,2021,4,24,2,4/1/2021,4/1/2021,4/18/2021,Saturday,Spring,1
4/25/2021,2021,4,25,2,4/1/2021,4/1/2021,4/25/2021,Sunday,Spring,1
4/26/2021,2021,4,26,2,4/1/2021,4/1/2021,4/25/2021,Monday,Spring,0
4/27/2021,2021,4,27,2,4/1/2021,4/1/2021,4/25/2021,Tuesday,Spring,0
4/28/2021,2021,4,28,2,4/1/2021,4/1/2021,4/25/2021,Wednesday,Spring,0
4/29/2021,2021,4,29,2,4/1/2021,4/1/2021,4/25/2021,Thursday,Spring,0
4/30/2021,2021,4,30,2,4/1/2021,4/1/2021,4/25/2021,Friday,Spring,0
5/1/2021,2021,5,1,2,4/1/2021,5/1/2021,4/25/2021,Saturday,Spring,1
5/2/2021,2021,5,2,2,4/1/2021,5/1/2021,5/2/2021,Sunday,Spring,1
5/3/2021,2021,5,3,2,4/1/2021,5/1/2021,5/2/2021,Monday,Spring,0
5/4/2021,2021,5,4,2,4/1/2021,5/1/2021,5/2/2021,Tuesday,Spring,0
5/5/2021,2021,5,5,2,4/1/2021,5/1/2021,5/2/2021,Wednesday,Spring,0
5/6/2021,2021,5,6,2,4/1/2021,5/1/2021,5/2/2021,Thursday,Spring,0
5/7/2021,2021,5,7,2,4/1/2021,5/1/2021,5/2/2021,Friday,Spring,0
5/8/2021,2021,5,8,2,4/1/2021,5/1/2021,5/2/2021,Saturday,Spring,1
5/9/2021,2021,5,9,2,4/1/2021,5/1/2021,5/9/2021,Sunday,Spring,1
5/10/2021,2021,5,10,2,4/1/2021,5/1/2021,5/9/2021,Monday,Spring,0
5/11/2021,2021,5,11,2,4/1/2021,5/1/2021,5/9/2021,Tuesday,Spring,0
5/12/2021,2021,5,12,2,4/1/2021,5/1/2021,5/9/2021,Wednesday,Spring,0
5/13/2021,2021,5,13,2,4/1/2021,5/1/2021,5/9/2021,Thursday,Spring,0
5/14/2021,2021,5,14,2,4/1/2021,5/1/2021,5/9/2021,Friday,Spring,0
5/15/2021,2021,5,15,2,4/1/2021,5/1/2021,5/9/2021,Saturday,Spring,1
5/16/2021,2021,5,16,2,4/1/2021,5/1/2021,5/16/2021,Sunday,Spring,1
5/17/2021,2021,5,17,2,4/1/2021,5/1/2021,5/16/2021,Monday,Spring,0
5/18/2021,2021,5,18,2,4/1/2021,5/1/2021,5/16/2021,Tuesday,Spring,0
5/19/2021,2021,5,19,2,4/1/2021,5/1/2021,5/16/2021,Wednesday,Spring,0
5/20/2021,2021,5,20,2,4/1/2021,5/1/2021,5/16/2021,Thursday,Spring,0
5/21/2021,2021,5,21,2,4/1/2021,5/1/2021,5/16/2021,Friday,Spring,0
5/22/2021,2021,5,22,2,4/1/2021,5/1/2021,5/16/2021,Saturday,Spring,1
5/23/2021,2021,5,23,2,4/1/2021,5/1/2021,5/23/2021,Sunday,Spring,1
5/24/2021,2021,5,24,2,4/1/2021,5/1/2021,5/23/2021,Monday,Spring,0
5/25/2021,2021,5,25,2,4/1/2021,5/1/2021,5/23/2021,Tuesday,Spring,0
5/26/2021,2021,5,26,2,4/1/2021,5/1/2021,5/23/2021,Wednesday,Spring,0
5/27/2021,2021,5,27,2,4/1/2021,5/1/2021,5/23/2021,Thursday,Spring,0
5/28/2021,2021,5,28,2,4/1/2021,5/1/2021,5/23/2021,Friday,Spring,0
5/29/2021,2021,5,29,2,4/1/2021,5/1/2021,5/23/2021,Saturday,Spring,1
5/30/2021,2021,5,30,2,4/1/2021,5/1/2021,5/30/2021,Sunday,Spring,1
5/31/2021,2021,5,31,2,4/1/2021,5/1/2021,5/30/2021,Monday,Spring,0
6/1/2021,2021,6,1,2,4/1/2021,6/1/2021,5/30/2021,Tuesday,Summer,0
6/2/2021,2021,6,2,2,4/1/2021,6/1/2021,5/30/2021,Wednesday,Summer,0
6/3/2021,2021,6,3,2,4/1/2021,6/1/2021,5/30/2021,Thursday,Summer,0
6/4/2021,2021,6,4,2,4/1/2021,6/1/2021,5/30/2021,Friday,Summer,0
6/5/2021,2021,6,5,2,4/1/2021,6/1/2021,5/30/2021,Saturday,Summer,1
6/6/2021,2021,6,6,2,4/1/2021,6/1/2021,6/6/2021,Sunday,Summer,1
6/7/2021,2021,6,7,2,4/1/2021,6/1/2021,6/6/2021,Monday,Summer,0
6/8/2021,2021,6,8,2,4/1/2021,6/1/2021,6/6/2021,Tuesday,Summer,0
6/9/2021,2021,6,9,2,4/1/2021,6/1/2021,6/6/2021,Wednesday,Summer,0
6/10/2021,2021,6,10,2,4/1/2021,6/1/2021,6/6/2021,Thursday,Summer,0
6/11/2021,2021,6,11,2,4/1/2021,6/1/2021,6/6/2021,Friday,Summer,0
6/12/2021,2021,6,12,2,4/1/2021,6/1/2021,6/6/2021,Saturday,Summer,1
6/13/2021,2021,6,13,2,4/1/2021,6/1/2021,6/13/2021,Sunday,Summer,1
6/14/2021,2021,6,14,2,4/1/2021,6/1/2021,6/13/2021,Monday,Summer,0
6/15/2021,2021,6,15,2,4/1/2021,6/1/2021,6/13/2021,Tuesday,Summer,0
6/16/2021,2021,6,16,2,4/1/2021,6/1/2021,6/13/2021,Wednesday,Summer,0
6/17/2021,2021,6,17,2,4/1/2021,6/1/2021,6/13/2021,Thursday,Summer,0
6/18/2021,2021,6,18,2,4/1/2021,6/1/2021,6/13/2021,Friday,Summer,0
6/19/2021,2021,6,19,2,4/1/2021,6/1/2021,6/13/2021,Saturday,Summer,1
6/20/2021,2021,6,20,2,4/1/2021,6/1/2021,6/20/2021,Sunday,Summer,1
6/21/2021,2021,6,21,2,4/1/2021,6/1/2021,6/20/2021,Monday,Summer,0
6/22/2021,2021,6,22,2,4/1/2021,6/1/2021,6/20/2021,Tuesday,Summer,0
6/23/2021,2021,6,23,2,4/1/2021,6/1/2021,6/20/2021,Wednesday,Summer,0
6/24/2021,2021,6,24,2,4/1/2021,6/1/2021,6/20/2021,Thursday,Summer,0
6/25/2021,2021,6,25,2,4/1/2021,6/1/2021,6/20/2021,Friday,Summer,0
6/26/2021,2021,6,26,2,4/1/2021,6/1/2021,6/20/2021,Saturday,Summer,1
6/27/2021,2021,6,27,2,4/1/2021,6/1/2021,6/27/2021,Sunday,Summer,1
6/28/2021,2021,6,28,2,4/1/2021,6/1/2021,6/27/2021,Monday,Summer,0
6/29/2021,2021,6,29,2,4/1/2021,6/1/2021,6/27/2021,Tuesday,Summer,0
6/30/2021,2021,6,30,2,4/1/2021,6/1/2021,6/27/2021,Wednesday,Summer,0
7/1/2021,2021,7,1,2,7/1/2021,7/1/2021,6/27/2021,Thursday,Summer,0
7/2/2021,2021,7,2,2,7/1/2021,7/1/2021,6/27/2021,Friday,Summer,0
7/3/2021,2021,7,3,2,7/1/2021,7/1/2021,6/27/2021,Saturday,Summer,1
7/4/2021,2021,7,4,3,7/1/2021,7/1/2021,7/4/2021,Sunday,Summer,1
7/5/2021,2021,7,5,3,7/1/2021,7/1/2021,7/4/2021,Monday,Summer,0
7/6/2021,2021,7,6,3,7/1/2021,7/1/2021,7/4/2021,Tuesday,Summer,0
7/7/2021,2021,7,7,3,7/1/2021,7/1/2021,7/4/2021,Wednesday,Summer,0
7/8/2021,2021,7,8,3,7/1/2021,7/1/2021,7/4/2021,Thursday,Summer,0
7/9/2021,2021,7,9,3,7/1/2021,7/1/2021,7/4/2021,Friday,Summer,0
7/10/2021,2021,7,10,3,7/1/2021,7/1/2021,7/4/2021,Saturday,Summer,1
7/11/2021,2021,7,11,3,7/1/2021,7/1/2021,7/11/2021,Sunday,Summer,1
7/12/2021,2021,7,12,3,7/1/2021,7/1/2021,7/11/2021,Monday,Summer,0
7/13/2021,2021,7,13,3,7/1/2021,7/1/2021,7/11/2021,Tuesday,Summer,0
7/14/2021,2021,7,14,3,7/1/2021,7/1/2021,7/11/2021,Wednesday,Summer,0
7/15/2021,2021,7,15,3,7/1/2021,7/1/2021,7/11/2021,Thursday,Summer,0
7/16/2021,2021,7,16,3,7/1/2021,7/1/2021,7/11/2021,Friday,Summer,0
7/17/2021,2021,7,17,3,7/1/2021,7/1/2021,7/11/2021,Saturday,Summer,1
7/18/2021,2021,7,18,3,7/1/2021,7/1/2021,7/18/2021,Sunday,Summer,1
7/19/2021,2021,7,19,3,7/1/2021,7/1/2021,7/18/2021,Monday,Summer,0
7/20/2021,2021,7,20,3,7/1/2021,7/1/2021,7/18/2021,Tuesday,Summer,0
7/21/2021,2021,7,21,3,7/1/2021,7/1/2021,7/18/2021,Wednesday,Summer,0
7/22/2021,2021,7,22,3,7/1/2021,7/1/2021,7/18/2021,Thursday,Summer,0
7/23/2021,2021,7,23,3,7/1/2021,7/1/2021,7/18/2021,Friday,Summer,0
7/24/2021,2021,7,24,3,7/1/2021,7/1/2021,7/18/2021,Saturday,Summer,1
7/25/2021,2021,7,25,3,7/1/2021,7/1/2021,7/25/2021,Sunday,Summer,1
7/26/2021,2021,7,26,3,7/1/2021,7/1/2021,7/25/2021,Monday,Summer,0
7/27/2021,2021,7,27,3,7/1/2021,7/1/2021,7/25/2021,Tuesday,Summer,0
7/28/2021,2021,7,28,3,7/1/2021,7/1/2021,7/25/2021,Wednesday,Summer,0
7/29/2021,2021,7,29,3,7/1/2021,7/1/2021,7/25/2021,Thursday,Summer,0
7/30/2021,2021,7,30,3,7/1/2021,7/1/2021,7/25/2021,Friday,Summer,0
7/31/2021,2021,7,31,3,7/1/2021,7/1/2021,7/25/2021,Saturday,Summer,1
8/1/2021,2021,8,1,3,7/1/2021,8/1/2021,8/1/2021,Sunday,Summer,1
8/2/2021,2021,8,2,3,7/1/2021,8/1/2021,8/1/2021,Monday,Summer,0
8/3/2021,2021,8,3,3,7/1/2021,8/1/2021,8/1/2021,Tuesday,Summer,0
8/4/2021,2021,8,4,3,7/1/2021,8/1/2021,8/1/2021,Wednesday,Summer,0
8/5/2021,2021,8,5,3,7/1/2021,8/1/2021,8/1/2021,Thursday,Summer,0
8/6/2021,2021,8,6,3,7/1/2021,8/1/2021,8/1/2021,Friday,Summer,0
8/7/2021,2021,8,7,3,7/1/2021,8/1/2021,8/1/2021,Saturday,Summer,1
8/8/2021,2021,8,8,3,7/1/2021,8/1/2021,8/8/2021,Sunday,Summer,1
8/9/2021,2021,8,9,3,7/1/2021,8/1/2021,8/8/2021,Monday,Summer,0
8/10/2021,2021,8,10,3,7/1/2021,8/1/2021,8/8/2021,Tuesday,Summer,0
8/11/2021,2021,8,11,3,7/1/2021,8/1/2021,8/8/2021,Wednesday,Summer,0
8/12/2021,2021,8,12,3,7/1/2021,8/1/2021,8/8/2021,Thursday,Summer,0
8/13/2021,2021,8,13,3,7/1/2021,8/1/2021,8/8/2021,Friday,Summer,0
8/14/2021,2021,8,14,3,7/1/2021,8/1/2021,8/8/2021,Saturday,Summer,1
8/15/2021,2021,8,15,3,7/1/2021,8/1/2021,8/15/2021,Sunday,Summer,1
8/16/2021,2021,8,16,3,7/1/2021,8/1/2021,8/15/2021,Monday,Summer,0
8/17/2021,2021,8,17,3,7/1/2021,8/1/2021,8/15/2021,Tuesday,Summer,0
8/18/2021,2021,8,18,3,7/1/2021,8/1/2021,8/15/2021,Wednesday,Summer,0
8/19/2021,2021,8,19,3,7/1/2021,8/1/2021,8/15/2021,Thursday,Summer,0
8/20/2021,2021,8,20,3,7/1/2021,8/1/2021,8/15/2021,Friday,Summer,0
8/21/2021,2021,8,21,3,7/1/2021,8/1/2021,8/15/2021,Saturday,Summer,1
8/22/2021,2021,8,22,3,7/1/2021,8/1/2021,8/22/2021,Sunday,Summer,1
8/23/2021,2021,8,23,3,7/1/2021,8/1/2021,8/22/2021,Monday,Summer,0
8/24/2021,2021,8,24,3,7/1/2021,8/1/2021,8/22/2021,Tuesday,Summer,0
8/25/2021,2021,8,25,3,7/1/2021,8/1/2021,8/22/2021,Wednesday,Summer,0
8/26/2021,2021,8,26,3,7/1/2021,8/1/2021,8/22/2021,Thursday,Summer,0
8/27/2021,2021,8,27,3,7/1/2021,8/1/2021,8/22/2021,Friday,Summer,0
8/28/2021,2021,8,28,3,7/1/2021,8/1/2021,8/22/2021,Saturday,Summer,1
8/29/2021,2021,8,29,3,7/1/2021,8/1/2021,8/29/2021,Sunday,Summer,1
8/30/2021,2021,8,30,3,7/1/2021,8/1/2021,8/29/2021,Monday,Summer,0
8/31/2021,2021,8,31,3,7/1/2021,8/1/2021,8/29/2021,Tuesday,Summer,0
9/1/2021,2021,9,1,3,7/1/2021,9/1/2021,8/29/2021,Wednesday,Fall,0
9/2/2021,2021,9,2,3,7/1/2021,9/1/2021,8/29/2021,Thursday,Fall,0
9/3/2021,2021,9,3,3,7/1/2021,9/1/2021,8/29/2021,Friday,Fall,0
9/4/2021,2021,9,4,3,7/1/2021,9/1/2021,8/29/2021,Saturday,Fall,1
9/5/2021,2021,9,5,3,7/1/2021,9/1/2021,9/5/2021,Sunday,Fall,1
9/6/2021,2021,9,6,3,7/1/2021,9/1/2021,9/5/2021,Monday,Fall,0
9/7/2021,2021,9,7,3,7/1/2021,9/1/2021,9/5/2021,Tuesday,Fall,0
9/8/2021,2021,9,8,3,7/1/2021,9/1/2021,9/5/2021,Wednesday,Fall,0
9/9/2021,2021,9,9,3,7/1/2021,9/1/2021,9/5/2021,Thursday,Fall,0
9/10/2021,2021,9,10,3,7/1/2021,9/1/2021,9/5/2021,Friday,Fall,0
9/11/2021,2021,9,11,3,7/1/2021,9/1/2021,9/5/2021,Saturday,Fall,1
9/12/2021,2021,9,12,3,7/1/2021,9/1/2021,9/12/2021,Sunday,Fall,1
9/13/2021,2021,9,13,3,7/1/2021,9/1/2021,9/12/2021,Monday,Fall,0
9/14/2021,2021,9,14,3,7/1/2021,9/1/2021,9/12/2021,Tuesday,Fall,0
9/15/2021,2021,9,15,3,7/1/2021,9/1/2021,9/12/2021,Wednesday,Fall,0
9/16/2021,2021,9,16,3,7/1/2021,9/1/2021,9/12/2021,Thursday,Fall,0
9/17/2021,2021,9,17,3,7/1/2021,9/1/2021,9/12/2021,Friday,Fall,0
9/18/2021,2021,9,18,3,7/1/2021,9/1/2021,9/12/2021,Saturday,Fall,1
9/19/2021,2021,9,19,3,7/1/2021,9/1/2021,9/19/2021,Sunday,Fall,1
9/20/2021,2021,9,20,3,7/1/2021,9/1/2021,9/19/2021,Monday,Fall,0
9/21/2021,2021,9,21,3,7/1/2021,9/1/2021,9/19/2021,Tuesday,Fall,0
9/22/2021,2021,9,22,3,7/1/2021,9/1/2021,9/19/2021,Wednesday,Fall,0
9/23/2021,2021,9,23,3,7/1/2021,9/1/2021,9/19/2021,Thursday,Fall,0
9/24/2021,2021,9,24,3,7/1/2021,9/1/2021,9/19/2021,Friday,Fall,0
9/25/2021,2021,9,25,3,7/1/2021,9/1/2021,9/19/2021,Saturday,Fall,1
9/26/2021,2021,9,26,3,7/1/2021,9/1/2021,9/26/2021,Sunday,Fall,1
9/27/2021,2021,9,27,3,7/1/2021,9/1/2021,9/26/2021,Monday,Fall,0
9/28/2021,2021,9,28,3,7/1/2021,9/1/2021,9/26/2021,Tuesday,Fall,0
9/29/2021,2021,9,29,3,7/1/2021,9/1/2021,9/26/2021,Wednesday,Fall,0
9/30/2021,2021,9,30,3,7/1/2021,9/1/2021,9/26/2021,Thursday,Fall,0
10/1/2021,2021,10,1,3,10/1/2021,10/1/2021,9/26/2021,Friday,Fall,0
10/2/2021,2021,10,2,3,10/1/2021,10/1/2021,9/26/2021,Saturday,Fall,1
10/3/2021,2021,10,3,4,10/1/2021,10/1/2021,10/3/2021,Sunday,Fall,1
10/4/2021,2021,10,4,4,10/1/2021,10/1/2021,10/3/2021,Monday,Fall,0
10/5/2021,2021,10,5,4,10/1/2021,10/1/2021,10/3/2021,Tuesday,Fall,0
10/6/2021,2021,10,6,4,10/1/2021,10/1/2021,10/3/2021,Wednesday,Fall,0
10/7/2021,2021,10,7,4,10/1/2021,10/1/2021,10/3/2021,Thursday,Fall,0
10/8/2021,2021,10,8,4,10/1/2021,10/1/2021,10/3/2021,Friday,Fall,0
10/9/2021,2021,10,9,4,10/1/2021,10/1/2021,10/3/2021,Saturday,Fall,1
10/10/2021,2021,10,10,4,10/1/2021,10/1/2021,10/10/2021,Sunday,Fall,1
10/11/2021,2021,10,11,4,10/1/2021,10/1/2021,10/10/2021,Monday,Fall,0
10/12/2021,2021,10,12,4,10/1/2021,10/1/2021,10/10/2021,Tuesday,Fall,0
10/13/2021,2021,10,13,4,10/1/2021,10/1/2021,10/10/2021,Wednesday,Fall,0
10/14/2021,2021,10,14,4,10/1/2021,10/1/2021,10/10/2021,Thursday,Fall,0
10/15/2021,2021,10,15,4,10/1/2021,10/1/2021,10/10/2021,Friday,Fall,0
10/16/2021,2021,10,16,4,10/1/2021,10/1/2021,10/10/2021,Saturday,Fall,1
10/17/2021,2021,10,17,4,10/1/2021,10/1/2021,10/17/2021,Sunday,Fall,1
10/18/2021,2021,10,18,4,10/1/2021,10/1/2021,10/17/2021,Monday,Fall,0
10/19/2021,2021,10,19,4,10/1/2021,10/1/2021,10/17/2021,Tuesday,Fall,0
10/20/2021,2021,10,20,4,10/1/2021,10/1/2021,10/17/2021,Wednesday,Fall,0
10/21/2021,2021,10,21,4,10/1/2021,10/1/2021,10/17/2021,Thursday,Fall,0
10/22/2021,2021,10,22,4,10/1/2021,10/1/2021,10/17/2021,Friday,Fall,0
10/23/2021,2021,10,23,4,10/1/2021,10/1/2021,10/17/2021,Saturday,Fall,1
10/24/2021,2021,10,24,4,10/1/2021,10/1/2021,10/24/2021,Sunday,Fall,1
10/25/2021,2021,10,25,4,10/1/2021,10/1/2021,10/24/2021,Monday,Fall,0
10/26/2021,2021,10,26,4,10/1/2021,10/1/2021,10/24/2021,Tuesday,Fall,0
10/27/2021,2021,10,27,4,10/1/2021,10/1/2021,10/24/2021,Wednesday,Fall,0
10/28/2021,2021,10,28,4,10/1/2021,10/1/2021,10/24/2021,Thursday,Fall,0
10/29/2021,2021,10,29,4,10/1/2021,10/1/2021,10/24/2021,Friday,Fall,0
10/30/2021,2021,10,30,4,10/1/2021,10/1/2021,10/24/2021,Saturday,Fall,1
10/31/2021,2021,10,31,4,10/1/2021,10/1/2021,10/31/2021,Sunday,Fall,1
11/1/2021,2021,11,1,4,10/1/2021,11/1/2021,10/31/2021,Monday,Fall,0
11/2/2021,2021,11,2,4,10/1/2021,11/1/2021,10/31/2021,Tuesday,Fall,0
11/3/2021,2021,11,3,4,10/1/2021,11/1/2021,10/31/2021,Wednesday,Fall,0
11/4/2021,2021,11,4,4,10/1/2021,11/1/2021,10/31/2021,Thursday,Fall,0
11/5/2021,2021,11,5,4,10/1/2021,11/1/2021,10/31/2021,Friday,Fall,0
11/6/2021,2021,11,6,4,10/1/2021,11/1/2021,10/31/2021,Saturday,Fall,1
11/7/2021,2021,11,7,4,10/1/2021,11/1/2021,11/7/2021,Sunday,Fall,1
11/8/2021,2021,11,8,4,10/1/2021,11/1/2021,11/7/2021,Monday,Fall,0
11/9/2021,2021,11,9,4,10/1/2021,11/1/2021,11/7/2021,Tuesday,Fall,0
11/10/2021,2021,11,10,4,10/1/2021,11/1/2021,11/7/2021,Wednesday,Fall,0
11/11/2021,2021,11,11,4,10/1/2021,11/1/2021,11/7/2021,Thursday,Fall,0
11/12/2021,2021,11,12,4,10/1/2021,11/1/2021,11/7/2021,Friday,Fall,0
11/13/2021,2021,11,13,4,10/1/2021,11/1/2021,11/7/2021,Saturday,Fall,1
11/14/2021,2021,11,14,4,10/1/2021,11/1/2021,11/14/2021,Sunday,Fall,1
11/15/2021,2021,11,15,4,10/1/2021,11/1/2021,11/14/2021,Monday,Fall,0
11/16/2021,2021,11,16,4,10/1/2021,11/1/2021,11/14/2021,Tuesday,Fall,0
11/17/2021,2021,11,17,4,10/1/2021,11/1/2021,11/14/2021,Wednesday,Fall,0
11/18/2021,2021,11,18,4,10/1/2021,11/1/2021,11/14/2021,Thursday,Fall,0
11/19/2021,2021,11,19,4,10/1/2021,11/1/2021,11/14/2021,Friday,Fall,0
11/20/2021,2021,11,20,4,10/1/2021,11/1/2021,11/14/2021,Saturday,Fall,1
11/21/2021,2021,11,21,4,10/1/2021,11/1/2021,11/21/2021,Sunday,Fall,1
11/22/2021,2021,11,22,4,10/1/2021,11/1/2021,11/21/2021,Monday,Fall,0
11/23/2021,2021,11,23,4,10/1/2021,11/1/2021,11/21/2021,Tuesday,Fall,0
11/24/2021,2021,11,24,4,10/1/2021,11/1/2021,11/21/2021,Wednesday,Fall,0
11/25/2021,2021,11,25,4,10/1/2021,11/1/2021,11/21/2021,Thursday,Fall,0
11/26/2021,2021,11,26,4,10/1/2021,11/1/2021,11/21/2021,Friday,Fall,0
11/27/2021,2021,11,27,4,10/1/2021,11/1/2021,11/21/2021,Saturday,Fall,1
11/28/2021,2021,11,28,4,10/1/2021,11/1/2021,11/28/2021,Sunday,Fall,1
11/29/2021,2021,11,29,4,10/1/2021,11/1/2021,11/28/2021,Monday,Fall,0
11/30/2021,2021,11,30,4,10/1/2021,11/1/2021,11/28/2021,Tuesday,Fall,0
12/1/2021,2021,12,1,4,10/1/2021,12/1/2021,11/28/2021,Wednesday,Winter,0
12/2/2021,2021,12,2,4,10/1/2021,12/1/2021,11/28/2021,Thursday,Winter,0
12/3/2021,2021,12,3,4,10/1/2021,12/1/2021,11/28/2021,Friday,Winter,0
12/4/2021,2021,12,4,4,10/1/2021,12/1/2021,11/28/2021,Saturday,Winter,1
12/5/2021,2021,12,5,4,10/1/2021,12/1/2021,12/5/2021,Sunday,Winter,1
12/6/2021,2021,12,6,4,10/1/2021,12/1/2021,12/5/2021,Monday,Winter,0
12/7/2021,2021,12,7,4,10/1/2021,12/1/2021,12/5/2021,Tuesday,Winter,0
12/8/2021,2021,12,8,4,10/1/2021,12/1/2021,12/5/2021,Wednesday,Winter,0
12/9/2021,2021,12,9,4,10/1/2021,12/1/2021,12/5/2021,Thursday,Winter,0
12/10/2021,2021,12,10,4,10/1/2021,12/1/2021,12/5/2021,Friday,Winter,0
12/11/2021,2021,12,11,4,10/1/2021,12/1/2021,12/5/2021,Saturday,Winter,1
12/12/2021,2021,12,12,4,10/1/2021,12/1/2021,12/12/2021,Sunday,Winter,1
12/13/2021,2021,12,13,4,10/1/2021,12/1/2021,12/12/2021,Monday,Winter,0
12/14/2021,2021,12,14,4,10/1/2021,12/1/2021,12/12/2021,Tuesday,Winter,0
12/15/2021,2021,12,15,4,10/1/2021,12/1/2021,12/12/2021,Wednesday,Winter,0
12/16/2021,2021,12,16,4,10/1/2021,12/1/2021,12/12/2021,Thursday,Winter,0
12/17/2021,2021,12,17,4,10/1/2021,12/1/2021,12/12/2021,Friday,Winter,0
12/18/2021,2021,12,18,4,10/1/2021,12/1/2021,12/12/2021,Saturday,Winter,1
12/19/2021,2021,12,19,4,10/1/2021,12/1/2021,12/19/2021,Sunday,Winter,1
12/20/2021,2021,12,20,4,10/1/2021,12/1/2021,12/19/2021,Monday,Winter,0
12/21/2021,2021,12,21,4,10/1/2021,12/1/2021,12/19/2021,Tuesday,Winter,0
12/22/2021,2021,12,22,4,10/1/2021,12/1/2021,12/19/2021,Wednesday,Winter,0
12/23/2021,2021,12,23,4,10/1/2021,12/1/2021,12/19/2021,Thursday,Winter,0
12/24/2021,2021,12,24,4,10/1/2021,12/1/2021,12/19/2021,Friday,Winter,0
12/25/2021,2021,12,25,4,10/1/2021,12/1/2021,12/19/2021,Saturday,Winter,1
12/26/2021,2021,12,26,4,10/1/2021,12/1/2021,12/26/2021,Sunday,Winter,1
12/27/2021,2021,12,27,4,10/1/2021,12/1/2021,12/26/2021,Monday,Winter,0
12/28/2021,2021,12,28,4,10/1/2021,12/1/2021,12/26/2021,Tuesday,Winter,0
12/29/2021,2021,12,29,4,10/1/2021,12/1/2021,12/26/2021,Wednesday,Winter,0
12/30/2021,2021,12,30,4,10/1/2021,12/1/2021,12/26/2021,Thursday,Winter,0
12/31/2021,2021,12,31,4,10/1/2021,12/1/2021,12/26/2021,Friday,Winter,0
1/1/2022,2022,1,1,4,1/1/2022,1/1/2022,12/26/2021,Saturday,Winter,1
1/2/2022,2022,1,2,1,1/1/2022,1/1/2022,1/2/2022,Sunday,Winter,1
1/3/2022,2022,1,3,1,1/1/2022,1/1/2022,1/2/2022,Monday,Winter,0
1/4/2022,2022,1,4,1,1/1/2022,1/1/2022,1/2/2022,Tuesday,Winter,0
1/5/2022,2022,1,5,1,1/1/2022,1/1/2022,1/2/2022,Wednesday,Winter,0
1/6/2022,2022,1,6,1,1/1/2022,1/1/2022,1/2/2022,Thursday,Winter,0
1/7/2022,2022,1,7,1,1/1/2022,1/1/2022,1/2/2022,Friday,Winter,0
1/8/2022,2022,1,8,1,1/1/2022,1/1/2022,1/2/2022,Saturday,Winter,1
1/9/2022,2022,1,9,1,1/1/2022,1/1/2022,1/9/2022,Sunday,Winter,1
1/10/2022,2022,1,10,1,1/1/2022,1/1/2022,1/9/2022,Monday,Winter,0
1/11/2022,2022,1,11,1,1/1/2022,1/1/2022,1/9/2022,Tuesday,Winter,0
1/12/2022,2022,1,12,1,1/1/2022,1/1/2022,1/9/2022,Wednesday,Winter,0
1/13/2022,2022,1,13,1,1/1/2022,1/1/2022,1/9/2022,Thursday,Winter,0
1/14/2022,2022,1,14,1,1/1/2022,1/1/2022,1/9/2022,Friday,Winter,0
1/15/2022,2022,1,15,1,1/1/2022,1/1/2022,1/9/2022,Saturday,Winter,1
1/16/2022,2022,1,16,1,1/1/2022,1/1/2022,1/16/2022,Sunday,Winter,1
1/17/2022,2022,1,17,1,1/1/2022,1/1/2022,1/16/2022,Monday,Winter,0
1/18/2022,2022,1,18,1,1/1/2022,1/1/2022,1/16/2022,Tuesday,Winter,0
1/19/2022,2022,1,19,1,1/1/2022,1/1/2022,1/16/2022,Wednesday,Winter,0
1/20/2022,2022,1,20,1,1/1/2022,1/1/2022,1/16/2022,Thursday,Winter,0
1/21/2022,2022,1,21,1,1/1/2022,1/1/2022,1/16/2022,Friday,Winter,0
1/22/2022,2022,1,22,1,1/1/2022,1/1/2022,1/16/2022,Saturday,Winter,1
1/23/2022,2022,1,23,1,1/1/2022,1/1/2022,1/23/2022,Sunday,Winter,1
1/24/2022,2022,1,24,1,1/1/2022,1/1/2022,1/23/2022,Monday,Winter,0
1/25/2022,2022,1,25,1,1/1/2022,1/1/2022,1/23/2022,Tuesday,Winter,0
1/26/2022,2022,1,26,1,1/1/2022,1/1/2022,1/23/2022,Wednesday,Winter,0
1/27/2022,2022,1,27,1,1/1/2022,1/1/2022,1/23/2022,Thursday,Winter,0
1/28/2022,2022,1,28,1,1/1/2022,1/1/2022,1/23/2022,Friday,Winter,0
1/29/2022,2022,1,29,1,1/1/2022,1/1/2022,1/23/2022,Saturday,Winter,1
1/30/2022,2022,1,30,1,1/1/2022,1/1/2022,1/30/2022,Sunday,Winter,1
1/31/2022,2022,1,31,1,1/1/2022,1/1/2022,1/30/2022,Monday,Winter,0
2/1/2022,2022,2,1,1,1/1/2022,2/1/2022,1/30/2022,Tuesday,Winter,0
2/2/2022,2022,2,2,1,1/1/2022,2/1/2022,1/30/2022,Wednesday,Winter,0
2/3/2022,2022,2,3,1,1/1/2022,2/1/2022,1/30/2022,Thursday,Winter,0
2/4/2022,2022,2,4,1,1/1/2022,2/1/2022,1/30/2022,Friday,Winter,0
2/5/2022,2022,2,5,1,1/1/2022,2/1/2022,1/30/2022,Saturday,Winter,1
2/6/2022,2022,2,6,1,1/1/2022,2/1/2022,2/6/2022,Sunday,Winter,1
2/7/2022,2022,2,7,1,1/1/2022,2/1/2022,2/6/2022,Monday,Winter,0
2/8/2022,2022,2,8,1,1/1/2022,2/1/2022,2/6/2022,Tuesday,Winter,0
2/9/2022,2022,2,9,1,1/1/2022,2/1/2022,2/6/2022,Wednesday,Winter,0
2/10/2022,2022,2,10,1,1/1/2022,2/1/2022,2/6/2022,Thursday,Winter,0
2/11/2022,2022,2,11,1,1/1/2022,2/1/2022,2/6/2022,Friday,Winter,0
2/12/2022,2022,2,12,1,1/1/2022,2/1/2022,2/6/2022,Saturday,Winter,1
2/13/2022,2022,2,13,1,1/1/2022,2/1/2022,2/13/2022,Sunday,Winter,1
2/14/2022,2022,2,14,1,1/1/2022,2/1/2022,2/13/2022,Monday,Winter,0
2/15/2022,2022,2,15,1,1/1/2022,2/1/2022,2/13/2022,Tuesday,Winter,0
2/16/2022,2022,2,16,1,1/1/2022,2/1/2022,2/13/2022,Wednesday,Winter,0
2/17/2022,2022,2,17,1,1/1/2022,2/1/2022,2/13/2022,Thursday,Winter,0
2/18/2022,2022,2,18,1,1/1/2022,2/1/2022,2/13/2022,Friday,Winter,0
2/19/2022,2022,2,19,1,1/1/2022,2/1/2022,2/13/2022,Saturday,Winter,1
2/20/2022,2022,2,20,1,1/1/2022,2/1/2022,2/20/2022,Sunday,Winter,1
2/21/2022,2022,2,21,1,1/1/2022,2/1/2022,2/20/2022,Monday,Winter,0
2/22/2022,2022,2,22,1,1/1/2022,2/1/2022,2/20/2022,Tuesday,Winter,0
2/23/2022,2022,2,23,1,1/1/2022,2/1/2022,2/20/2022,Wednesday,Winter,0
2/24/2022,2022,2,24,1,1/1/2022,2/1/2022,2/20/2022,Thursday,Winter,0
2/25/2022,2022,2,25,1,1/1/2022,2/1/2022,2/20/2022,Friday,Winter,0
2/26/2022,2022,2,26,1,1/1/2022,2/1/2022,2/20/2022,Saturday,Winter,1
2/27/2022,2022,2,27,1,1/1/2022,2/1/2022,2/27/2022,Sunday,Winter,1
2/28/2022,2022,2,28,1,1/1/2022,2/1/2022,2/27/2022,Monday,Winter,0
3/1/2022,2022,3,1,1,1/1/2022,3/1/2022,2/27/2022,Tuesday,Spring,0
3/2/2022,2022,3,2,1,1/1/2022,3/1/2022,2/27/2022,Wednesday,Spring,0
3/3/2022,2022,3,3,1,1/1/2022,3/1/2022,2/27/2022,Thursday,Spring,0
3/4/2022,2022,3,4,1,1/1/2022,3/1/2022,2/27/2022,Friday,Spring,0
3/5/2022,2022,3,5,1,1/1/2022,3/1/2022,2/27/2022,Saturday,Spring,1
3/6/2022,2022,3,6,1,1/1/2022,3/1/2022,3/6/2022,Sunday,Spring,1
3/7/2022,2022,3,7,1,1/1/2022,3/1/2022,3/6/2022,Monday,Spring,0
3/8/2022,2022,3,8,1,1/1/2022,3/1/2022,3/6/2022,Tuesday,Spring,0
3/9/2022,2022,3,9,1,1/1/2022,3/1/2022,3/6/2022,Wednesday,Spring,0
3/10/2022,2022,3,10,1,1/1/2022,3/1/2022,3/6/2022,Thursday,Spring,0
3/11/2022,2022,3,11,1,1/1/2022,3/1/2022,3/6/2022,Friday,Spring,0
3/12/2022,2022,3,12,1,1/1/2022,3/1/2022,3/6/2022,Saturday,Spring,1
3/13/2022,2022,3,13,1,1/1/2022,3/1/2022,3/13/2022,Sunday,Spring,1
3/14/2022,2022,3,14,1,1/1/2022,3/1/2022,3/13/2022,Monday,Spring,0
3/15/2022,2022,3,15,1,1/1/2022,3/1/2022,3/13/2022,Tuesday,Spring,0
3/16/2022,2022,3,16,1,1/1/2022,3/1/2022,3/13/2022,Wednesday,Spring,0
3/17/2022,2022,3,17,1,1/1/2022,3/1/2022,3/13/2022,Thursday,Spring,0
3/18/2022,2022,3,18,1,1/1/2022,3/1/2022,3/13/2022,Friday,Spring,0
3/19/2022,2022,3,19,1,1/1/2022,3/1/2022,3/13/2022,Saturday,Spring,1
3/20/2022,2022,3,20,1,1/1/2022,3/1/2022,3/20/2022,Sunday,Spring,1
3/21/2022,2022,3,21,1,1/1/2022,3/1/2022,3/20/2022,Monday,Spring,0
3/22/2022,2022,3,22,1,1/1/2022,3/1/2022,3/20/2022,Tuesday,Spring,0
3/23/2022,2022,3,23,1,1/1/2022,3/1/2022,3/20/2022,Wednesday,Spring,0
3/24/2022,2022,3,24,1,1/1/2022,3/1/2022,3/20/2022,Thursday,Spring,0
3/25/2022,2022,3,25,1,1/1/2022,3/1/2022,3/20/2022,Friday,Spring,0
3/26/2022,2022,3,26,1,1/1/2022,3/1/2022,3/20/2022,Saturday,Spring,1
3/27/2022,2022,3,27,1,1/1/2022,3/1/2022,3/27/2022,Sunday,Spring,1
3/28/2022,2022,3,28,1,1/1/2022,3/1/2022,3/27/2022,Monday,Spring,0
3/29/2022,2022,3,29,1,1/1/2022,3/1/2022,3/27/2022,Tuesday,Spring,0
3/30/2022,2022,3,30,1,1/1/2022,3/1/2022,3/27/2022,Wednesday,Spring,0
3/31/2022,2022,3,31,1,1/1/2022,3/1/2022,3/27/2022,Thursday,Spring,0
4/1/2022,2022,4,1,1,4/1/2022,4/1/2022,3/27/2022,Friday,Spring,0
4/2/2022,2022,4,2,1,4/1/2022,4/1/2022,3/27/2022,Saturday,Spring,1
4/3/2022,2022,4,3,2,4/1/2022,4/1/2022,4/3/2022,Sunday,Spring,1
4/4/2022,2022,4,4,2,4/1/2022,4/1/2022,4/3/2022,Monday,Spring,0
4/5/2022,2022,4,5,2,4/1/2022,4/1/2022,4/3/2022,Tuesday,Spring,0
4/6/2022,2022,4,6,2,4/1/2022,4/1/2022,4/3/2022,Wednesday,Spring,0
4/7/2022,2022,4,7,2,4/1/2022,4/1/2022,4/3/2022,Thursday,Spring,0
4/8/2022,2022,4,8,2,4/1/2022,4/1/2022,4/3/2022,Friday,Spring,0
4/9/2022,2022,4,9,2,4/1/2022,4/1/2022,4/3/2022,Saturday,Spring,1
4/10/2022,2022,4,10,2,4/1/2022,4/1/2022,4/10/2022,Sunday,Spring,1
4/11/2022,2022,4,11,2,4/1/2022,4/1/2022,4/10/2022,Monday,Spring,0
4/12/2022,2022,4,12,2,4/1/2022,4/1/2022,4/10/2022,Tuesday,Spring,0
4/13/2022,2022,4,13,2,4/1/2022,4/1/2022,4/10/2022,Wednesday,Spring,0
4/14/2022,2022,4,14,2,4/1/2022,4/1/2022,4/10/2022,Thursday,Spring,0
4/15/2022,2022,4,15,2,4/1/2022,4/1/2022,4/10/2022,Friday,Spring,0
4/16/2022,2022,4,16,2,4/1/2022,4/1/2022,4/10/2022,Saturday,Spring,1
4/17/2022,2022,4,17,2,4/1/2022,4/1/2022,4/17/2022,Sunday,Spring,1
4/18/2022,2022,4,18,2,4/1/2022,4/1/2022,4/17/2022,Monday,Spring,0
4/19/2022,2022,4,19,2,4/1/2022,4/1/2022,4/17/2022,Tuesday,Spring,0
4/20/2022,2022,4,20,2,4/1/2022,4/1/2022,4/17/2022,Wednesday,Spring,0
4/21/2022,2022,4,21,2,4/1/2022,4/1/2022,4/17/2022,Thursday,Spring,0
4/22/2022,2022,4,22,2,4/1/2022,4/1/2022,4/17/2022,Friday,Spring,0
4/23/2022,2022,4,23,2,4/1/2022,4/1/2022,4/17/2022,Saturday,Spring,1
4/24/2022,2022,4,24,2,4/1/2022,4/1/2022,4/24/2022,Sunday,Spring,1
4/25/2022,2022,4,25,2,4/1/2022,4/1/2022,4/24/2022,Monday,Spring,0
4/26/2022,2022,4,26,2,4/1/2022,4/1/2022,4/24/2022,Tuesday,Spring,0
4/27/2022,2022,4,27,2,4/1/2022,4/1/2022,4/24/2022,Wednesday,Spring,0
4/28/2022,2022,4,28,2,4/1/2022,4/1/2022,4/24/2022,Thursday,Spring,0
4/29/2022,2022,4,29,2,4/1/2022,4/1/2022,4/24/2022,Friday,Spring,0
4/30/2022,2022,4,30,2,4/1/2022,4/1/2022,4/24/2022,Saturday,Spring,1
5/1/2022,2022,5,1,2,4/1/2022,5/1/2022,5/1/2022,Sunday,Spring,1
5/2/2022,2022,5,2,2,4/1/2022,5/1/2022,5/1/2022,Monday,Spring,0
5/3/2022,2022,5,3,2,4/1/2022,5/1/2022,5/1/2022,Tuesday,Spring,0
5/4/2022,2022,5,4,2,4/1/2022,5/1/2022,5/1/2022,Wednesday,Spring,0
5/5/2022,2022,5,5,2,4/1/2022,5/1/2022,5/1/2022,Thursday,Spring,0
5/6/2022,2022,5,6,2,4/1/2022,5/1/2022,5/1/2022,Friday,Spring,0
5/7/2022,2022,5,7,2,4/1/2022,5/1/2022,5/1/2022,Saturday,Spring,1
5/8/2022,2022,5,8,2,4/1/2022,5/1/2022,5/8/2022,Sunday,Spring,1
5/9/2022,2022,5,9,2,4/1/2022,5/1/2022,5/8/2022,Monday,Spring,0
5/10/2022,2022,5,10,2,4/1/2022,5/1/2022,5/8/2022,Tuesday,Spring,0
5/11/2022,2022,5,11,2,4/1/2022,5/1/2022,5/8/2022,Wednesday,Spring,0
5/12/2022,2022,5,12,2,4/1/2022,5/1/2022,5/8/2022,Thursday,Spring,0
5/13/2022,2022,5,13,2,4/1/2022,5/1/2022,5/8/2022,Friday,Spring,0
5/14/2022,2022,5,14,2,4/1/2022,5/1/2022,5/8/2022,Saturday,Spring,1
5/15/2022,2022,5,15,2,4/1/2022,5/1/2022,5/15/2022,Sunday,Spring,1
5/16/2022,2022,5,16,2,4/1/2022,5/1/2022,5/15/2022,Monday,Spring,0
5/17/2022,2022,5,17,2,4/1/2022,5/1/2022,5/15/2022,Tuesday,Spring,0
5/18/2022,2022,5,18,2,4/1/2022,5/1/2022,5/15/2022,Wednesday,Spring,0
5/19/2022,2022,5,19,2,4/1/2022,5/1/2022,5/15/2022,Thursday,Spring,0
5/20/2022,2022,5,20,2,4/1/2022,5/1/2022,5/15/2022,Friday,Spring,0
5/21/2022,2022,5,21,2,4/1/2022,5/1/2022,5/15/2022,Saturday,Spring,1
5/22/2022,2022,5,22,2,4/1/2022,5/1/2022,5/22/2022,Sunday,Spring,1
5/23/2022,2022,5,23,2,4/1/2022,5/1/2022,5/22/2022,Monday,Spring,0
5/24/2022,2022,5,24,2,4/1/2022,5/1/2022,5/22/2022,Tuesday,Spring,0
5/25/2022,2022,5,25,2,4/1/2022,5/1/2022,5/22/2022,Wednesday,Spring,0
5/26/2022,2022,5,26,2,4/1/2022,5/1/2022,5/22/2022,Thursday,Spring,0
5/27/2022,2022,5,27,2,4/1/2022,5/1/2022,5/22/2022,Friday,Spring,0
5/28/2022,2022,5,28,2,4/1/2022,5/1/2022,5/22/2022,Saturday,Spring,1
5/29/2022,2022,5,29,2,4/1/2022,5/1/2022,5/29/2022,Sunday,Spring,1
5/30/2022,2022,5,30,2,4/1/2022,5/1/2022,5/29/2022,Monday,Spring,0
5/31/2022,2022,5,31,2,4/1/2022,5/1/2022,5/29/2022,Tuesday,Spring,0
6/1/2022,2022,6,1,2,4/1/2022,6/1/2022,5/29/2022,Wednesday,Summer,0
6/2/2022,2022,6,2,2,4/1/2022,6/1/2022,5/29/2022,Thursday,Summer,0
6/3/2022,2022,6,3,2,4/1/2022,6/1/2022,5/29/2022,Friday,Summer,0
6/4/2022,2022,6,4,2,4/1/2022,6/1/2022,5/29/2022,Saturday,Summer,1
6/5/2022,2022,6,5,2,4/1/2022,6/1/2022,6/5/2022,Sunday,Summer,1
6/6/2022,2022,6,6,2,4/1/2022,6/1/2022,6/5/2022,Monday,Summer,0
6/7/2022,2022,6,7,2,4/1/2022,6/1/2022,6/5/2022,Tuesday,Summer,0
6/8/2022,2022,6,8,2,4/1/2022,6/1/2022,6/5/2022,Wednesday,Summer,0
6/9/2022,2022,6,9,2,4/1/2022,6/1/2022,6/5/2022,Thursday,Summer,0
6/10/2022,2022,6,10,2,4/1/2022,6/1/2022,6/5/2022,Friday,Summer,0
6/11/2022,2022,6,11,2,4/1/2022,6/1/2022,6/5/2022,Saturday,Summer,1
6/12/2022,2022,6,12,2,4/1/2022,6/1/2022,6/12/2022,Sunday,Summer,1
6/13/2022,2022,6,13,2,4/1/2022,6/1/2022,6/12/2022,Monday,Summer,0
6/14/2022,2022,6,14,2,4/1/2022,6/1/2022,6/12/2022,Tuesday,Summer,0
6/15/2022,2022,6,15,2,4/1/2022,6/1/2022,6/12/2022,Wednesday,Summer,0
6/16/2022,2022,6,16,2,4/1/2022,6/1/2022,6/12/2022,Thursday,Summer,0
6/17/2022,2022,6,17,2,4/1/2022,6/1/2022,6/12/2022,Friday,Summer,0
6/18/2022,2022,6,18,2,4/1/2022,6/1/2022,6/12/2022,Saturday,Summer,1
6/19/2022,2022,6,19,2,4/1/2022,6/1/2022,6/19/2022,Sunday,Summer,1
6/20/2022,2022,6,20,2,4/1/2022,6/1/2022,6/19/2022,Monday,Summer,0
6/21/2022,2022,6,21,2,4/1/2022,6/1/2022,6/19/2022,Tuesday,Summer,0
6/22/2022,2022,6,22,2,4/1/2022,6/1/2022,6/19/2022,Wednesday,Summer,0
6/23/2022,2022,6,23,2,4/1/2022,6/1/2022,6/19/2022,Thursday,Summer,0
6/24/2022,2022,6,24,2,4/1/2022,6/1/2022,6/19/2022,Friday,Summer,0
6/25/2022,2022,6,25,2,4/1/2022,6/1/2022,6/19/2022,Saturday,Summer,1
6/26/2022,2022,6,26,2,4/1/2022,6/1/2022,6/26/2022,Sunday,Summer,1
6/27/2022,2022,6,27,2,4/1/2022,6/1/2022,6/26/2022,Monday,Summer,0
6/28/2022,2022,6,28,2,4/1/2022,6/1/2022,6/26/2022,Tuesday,Summer,0
6/29/2022,2022,6,29,2,4/1/2022,6/1/2022,6/26/2022,Wednesday,Summer,0
6/30/2022,2022,6,30,2,4/1/2022,6/1/2022,6/26/2022,Thursday,Summer,0
7/1/2022,2022,7,1,2,7/1/2022,7/1/2022,6/26/2022,Friday,Summer,0
7/2/2022,2022,7,2,2,7/1/2022,7/1/2022,6/26/2022,Saturday,Summer,1
7/3/2022,2022,7,3,3,7/1/2022,7/1/2022,7/3/2022,Sunday,Summer,1
7/4/2022,2022,7,4,3,7/1/2022,7/1/2022,7/3/2022,Monday,Summer,0
7/5/2022,2022,7,5,3,7/1/2022,7/1/2022,7/3/2022,Tuesday,Summer,0
7/6/2022,2022,7,6,3,7/1/2022,7/1/2022,7/3/2022,Wednesday,Summer,0
7/7/2022,2022,7,7,3,7/1/2022,7/1/2022,7/3/2022,Thursday,Summer,0
7/8/2022,2022,7,8,3,7/1/2022,7/1/2022,7/3/2022,Friday,Summer,0
7/9/2022,2022,7,9,3,7/1/2022,7/1/2022,7/3/2022,Saturday,Summer,1
7/10/2022,2022,7,10,3,7/1/2022,7/1/2022,7/10/2022,Sunday,Summer,1
7/11/2022,2022,7,11,3,7/1/2022,7/1/2022,7/10/2022,Monday,Summer,0
7/12/2022,2022,7,12,3,7/1/2022,7/1/2022,7/10/2022,Tuesday,Summer,0
7/13/2022,2022,7,13,3,7/1/2022,7/1/2022,7/10/2022,Wednesday,Summer,0
7/14/2022,2022,7,14,3,7/1/2022,7/1/2022,7/10/2022,Thursday,Summer,0
7/15/2022,2022,7,15,3,7/1/2022,7/1/2022,7/10/2022,Friday,Summer,0
7/16/2022,2022,7,16,3,7/1/2022,7/1/2022,7/10/2022,Saturday,Summer,1
7/17/2022,2022,7,17,3,7/1/2022,7/1/2022,7/17/2022,Sunday,Summer,1
7/18/2022,2022,7,18,3,7/1/2022,7/1/2022,7/17/2022,Monday,Summer,0
7/19/2022,2022,7,19,3,7/1/2022,7/1/2022,7/17/2022,Tuesday,Summer,0
7/20/2022,2022,7,20,3,7/1/2022,7/1/2022,7/17/2022,Wednesday,Summer,0
7/21/2022,2022,7,21,3,7/1/2022,7/1/2022,7/17/2022,Thursday,Summer,0
7/22/2022,2022,7,22,3,7/1/2022,7/1/2022,7/17/2022,Friday,Summer,0
7/23/2022,2022,7,23,3,7/1/2022,7/1/2022,7/17/2022,Saturday,Summer,1
7/24/2022,2022,7,24,3,7/1/2022,7/1/2022,7/24/2022,Sunday,Summer,1
7/25/2022,2022,7,25,3,7/1/2022,7/1/2022,7/24/2022,Monday,Summer,0
7/26/2022,2022,7,26,3,7/1/2022,7/1/2022,7/24/2022,Tuesday,Summer,0
7/27/2022,2022,7,27,3,7/1/2022,7/1/2022,7/24/2022,Wednesday,Summer,0
7/28/2022,2022,7,28,3,7/1/2022,7/1/2022,7/24/2022,Thursday,Summer,0
7/29/2022,2022,7,29,3,7/1/2022,7/1/2022,7/24/2022,Friday,Summer,0
7/30/2022,2022,7,30,3,7/1/2022,7/1/2022,7/24/2022,Saturday,Summer,1
7/31/2022,2022,7,31,3,7/1/2022,7/1/2022,7/31/2022,Sunday,Summer,1
8/1/2022,2022,8,1,3,7/1/2022,8/1/2022,7/31/2022,Monday,Summer,0
8/2/2022,2022,8,2,3,7/1/2022,8/1/2022,7/31/2022,Tuesday,Summer,0
8/3/2022,2022,8,3,3,7/1/2022,8/1/2022,7/31/2022,Wednesday,Summer,0
8/4/2022,2022,8,4,3,7/1/2022,8/1/2022,7/31/2022,Thursday,Summer,0
8/5/2022,2022,8,5,3,7/1/2022,8/1/2022,7/31/2022,Friday,Summer,0
8/6/2022,2022,8,6,3,7/1/2022,8/1/2022,7/31/2022,Saturday,Summer,1
8/7/2022,2022,8,7,3,7/1/2022,8/1/2022,8/7/2022,Sunday,Summer,1
8/8/2022,2022,8,8,3,7/1/2022,8/1/2022,8/7/2022,Monday,Summer,0
8/9/2022,2022,8,9,3,7/1/2022,8/1/2022,8/7/2022,Tuesday,Summer,0
8/10/2022,2022,8,10,3,7/1/2022,8/1/2022,8/7/2022,Wednesday,Summer,0
8/11/2022,2022,8,11,3,7/1/2022,8/1/2022,8/7/2022,Thursday,Summer,0
8/12/2022,2022,8,12,3,7/1/2022,8/1/2022,8/7/2022,Friday,Summer,0
8/13/2022,2022,8,13,3,7/1/2022,8/1/2022,8/7/2022,Saturday,Summer,1
8/14/2022,2022,8,14,3,7/1/2022,8/1/2022,8/14/2022,Sunday,Summer,1
8/15/2022,2022,8,15,3,7/1/2022,8/1/2022,8/14/2022,Monday,Summer,0
8/16/2022,2022,8,16,3,7/1/2022,8/1/2022,8/14/2022,Tuesday,Summer,0
8/17/2022,2022,8,17,3,7/1/2022,8/1/2022,8/14/2022,Wednesday,Summer,0
8/18/2022,2022,8,18,3,7/1/2022,8/1/2022,8/14/2022,Thursday,Summer,0
8/19/2022,2022,8,19,3,7/1/2022,8/1/2022,8/14/2022,Friday,Summer,0
8/20/2022,2022,8,20,3,7/1/2022,8/1/2022,8/14/2022,Saturday,Summer,1
8/21/2022,2022,8,21,3,7/1/2022,8/1/2022,8/21/2022,Sunday,Summer,1
8/22/2022,2022,8,22,3,7/1/2022,8/1/2022,8/21/2022,Monday,Summer,0
8/23/2022,2022,8,23,3,7/1/2022,8/1/2022,8/21/2022,Tuesday,Summer,0
8/24/2022,2022,8,24,3,7/1/2022,8/1/2022,8/21/2022,Wednesday,Summer,0
8/25/2022,2022,8,25,3,7/1/2022,8/1/2022,8/21/2022,Thursday,Summer,0
8/26/2022,2022,8,26,3,7/1/2022,8/1/2022,8/21/2022,Friday,Summer,0
8/27/2022,2022,8,27,3,7/1/2022,8/1/2022,8/21/2022,Saturday,Summer,1
8/28/2022,2022,8,28,3,7/1/2022,8/1/2022,8/28/2022,Sunday,Summer,1
8/29/2022,2022,8,29,3,7/1/2022,8/1/2022,8/28/2022,Monday,Summer,0
8/30/2022,2022,8,30,3,7/1/2022,8/1/2022,8/28/2022,Tuesday,Summer,0
8/31/2022,2022,8,31,3,7/1/2022,8/1/2022,8/28/2022,Wednesday,Summer,0
9/1/2022,2022,9,1,3,7/1/2022,9/1/2022,8/28/2022,Thursday,Fall,0
9/2/2022,2022,9,2,3,7/1/2022,9/1/2022,8/28/2022,Friday,Fall,0
9/3/2022,2022,9,3,3,7/1/2022,9/1/2022,8/28/2022,Saturday,Fall,1
9/4/2022,2022,9,4,3,7/1/2022,9/1/2022,9/4/2022,Sunday,Fall,1
9/5/2022,2022,9,5,3,7/1/2022,9/1/2022,9/4/2022,Monday,Fall,0
9/6/2022,2022,9,6,3,7/1/2022,9/1/2022,9/4/2022,Tuesday,Fall,0
9/7/2022,2022,9,7,3,7/1/2022,9/1/2022,9/4/2022,Wednesday,Fall,0
9/8/2022,2022,9,8,3,7/1/2022,9/1/2022,9/4/2022,Thursday,Fall,0
9/9/2022,2022,9,9,3,7/1/2022,9/1/2022,9/4/2022,Friday,Fall,0
9/10/2022,2022,9,10,3,7/1/2022,9/1/2022,9/4/2022,Saturday,Fall,1
9/11/2022,2022,9,11,3,7/1/2022,9/1/2022,9/11/2022,Sunday,Fall,1
9/12/2022,2022,9,12,3,7/1/2022,9/1/2022,9/11/2022,Monday,Fall,0
9/13/2022,2022,9,13,3,7/1/2022,9/1/2022,9/11/2022,Tuesday,Fall,0
9/14/2022,2022,9,14,3,7/1/2022,9/1/2022,9/11/2022,Wednesday,Fall,0
9/15/2022,2022,9,15,3,7/1/2022,9/1/2022,9/11/2022,Thursday,Fall,0
9/16/2022,2022,9,16,3,7/1/2022,9/1/2022,9/11/2022,Friday,Fall,0
9/17/2022,2022,9,17,3,7/1/2022,9/1/2022,9/11/2022,Saturday,Fall,1
9/18/2022,2022,9,18,3,7/1/2022,9/1/2022,9/18/2022,Sunday,Fall,1
9/19/2022,2022,9,19,3,7/1/2022,9/1/2022,9/18/2022,Monday,Fall,0
9/20/2022,2022,9,20,3,7/1/2022,9/1/2022,9/18/2022,Tuesday,Fall,0
9/21/2022,2022,9,21,3,7/1/2022,9/1/2022,9/18/2022,Wednesday,Fall,0
9/22/2022,2022,9,22,3,7/1/2022,9/1/2022,9/18/2022,Thursday,Fall,0
9/23/2022,2022,9,23,3,7/1/2022,9/1/2022,9/18/2022,Friday,Fall,0
9/24/2022,2022,9,24,3,7/1/2022,9/1/2022,9/18/2022,Saturday,Fall,1
9/25/2022,2022,9,25,3,7/1/2022,9/1/2022,9/25/2022,Sunday,Fall,1
9/26/2022,2022,9,26,3,7/1/2022,9/1/2022,9/25/2022,Monday,Fall,0
9/27/2022,2022,9,27,3,7/1/2022,9/1/2022,9/25/2022,Tuesday,Fall,0
9/28/2022,2022,9,28,3,7/1/2022,9/1/2022,9/25/2022,Wednesday,Fall,0
9/29/2022,2022,9,29,3,7/1/2022,9/1/2022,9/25/2022,Thursday,Fall,0
9/30/2022,2022,9,30,3,7/1/2022,9/1/2022,9/25/2022,Friday,Fall,0
10/1/2022,2022,10,1,3,10/1/2022,10/1/2022,9/25/2022,Saturday,Fall,1
10/2/2022,2022,10,2,4,10/1/2022,10/1/2022,10/2/2022,Sunday,Fall,1
10/3/2022,2022,10,3,4,10/1/2022,10/1/2022,10/2/2022,Monday,Fall,0
10/4/2022,2022,10,4,4,10/1/2022,10/1/2022,10/2/2022,Tuesday,Fall,0
10/5/2022,2022,10,5,4,10/1/2022,10/1/2022,10/2/2022,Wednesday,Fall,0
10/6/2022,2022,10,6,4,10/1/2022,10/1/2022,10/2/2022,Thursday,Fall,0
10/7/2022,2022,10,7,4,10/1/2022,10/1/2022,10/2/2022,Friday,Fall,0
10/8/2022,2022,10,8,4,10/1/2022,10/1/2022,10/2/2022,Saturday,Fall,1
10/9/2022,2022,10,9,4,10/1/2022,10/1/2022,10/9/2022,Sunday,Fall,1
10/10/2022,2022,10,10,4,10/1/2022,10/1/2022,10/9/2022,Monday,Fall,0
10/11/2022,2022,10,11,4,10/1/2022,10/1/2022,10/9/2022,Tuesday,Fall,0
10/12/2022,2022,10,12,4,10/1/2022,10/1/2022,10/9/2022,Wednesday,Fall,0
10/13/2022,2022,10,13,4,10/1/2022,10/1/2022,10/9/2022,Thursday,Fall,0
10/14/2022,2022,10,14,4,10/1/2022,10/1/2022,10/9/2022,Friday,Fall,0
10/15/2022,2022,10,15,4,10/1/2022,10/1/2022,10/9/2022,Saturday,Fall,1
10/16/2022,2022,10,16,4,10/1/2022,10/1/2022,10/16/2022,Sunday,Fall,1
10/17/2022,2022,10,17,4,10/1/2022,10/1/2022,10/16/2022,Monday,Fall,0
10/18/2022,2022,10,18,4,10/1/2022,10/1/2022,10/16/2022,Tuesday,Fall,0
10/19/2022,2022,10,19,4,10/1/2022,10/1/2022,10/16/2022,Wednesday,Fall,0
10/20/2022,2022,10,20,4,10/1/2022,10/1/2022,10/16/2022,Thursday,Fall,0
10/21/2022,2022,10,21,4,10/1/2022,10/1/2022,10/16/2022,Friday,Fall,0
10/22/2022,2022,10,22,4,10/1/2022,10/1/2022,10/16/2022,Saturday,Fall,1
10/23/2022,2022,10,23,4,10/1/2022,10/1/2022,10/23/2022,Sunday,Fall,1
10/24/2022,2022,10,24,4,10/1/2022,10/1/2022,10/23/2022,Monday,Fall,0
10/25/2022,2022,10,25,4,10/1/2022,10/1/2022,10/23/2022,Tuesday,Fall,0
10/26/2022,2022,10,26,4,10/1/2022,10/1/2022,10/23/2022,Wednesday,Fall,0
10/27/2022,2022,10,27,4,10/1/2022,10/1/2022,10/23/2022,Thursday,Fall,0
10/28/2022,2022,10,28,4,10/1/2022,10/1/2022,10/23/2022,Friday,Fall,0
10/29/2022,2022,10,29,4,10/1/2022,10/1/2022,10/23/2022,Saturday,Fall,1
10/30/2022,2022,10,30,4,10/1/2022,10/1/2022,10/30/2022,Sunday,Fall,1
10/31/2022,2022,10,31,4,10/1/2022,10/1/2022,10/30/2022,Monday,Fall,0
11/1/2022,2022,11,1,4,10/1/2022,11/1/2022,10/30/2022,Tuesday,Fall,0
11/2/2022,2022,11,2,4,10/1/2022,11/1/2022,10/30/2022,Wednesday,Fall,0
11/3/2022,2022,11,3,4,10/1/2022,11/1/2022,10/30/2022,Thursday,Fall,0
11/4/2022,2022,11,4,4,10/1/2022,11/1/2022,10/30/2022,Friday,Fall,0
11/5/2022,2022,11,5,4,10/1/2022,11/1/2022,10/30/2022,Saturday,Fall,1
11/6/2022,2022,11,6,4,10/1/2022,11/1/2022,11/6/2022,Sunday,Fall,1
11/7/2022,2022,11,7,4,10/1/2022,11/1/2022,11/6/2022,Monday,Fall,0
11/8/2022,2022,11,8,4,10/1/2022,11/1/2022,11/6/2022,Tuesday,Fall,0
11/9/2022,2022,11,9,4,10/1/2022,11/1/2022,11/6/2022,Wednesday,Fall,0
11/10/2022,2022,11,10,4,10/1/2022,11/1/2022,11/6/2022,Thursday,Fall,0
11/11/2022,2022,11,11,4,10/1/2022,11/1/2022,11/6/2022,Friday,Fall,0
11/12/2022,2022,11,12,4,10/1/2022,11/1/2022,11/6/2022,Saturday,Fall,1
11/13/2022,2022,11,13,4,10/1/2022,11/1/2022,11/13/2022,Sunday,Fall,1
11/14/2022,2022,11,14,4,10/1/2022,11/1/2022,11/13/2022,Monday,Fall,0
11/15/2022,2022,11,15,4,10/1/2022,11/1/2022,11/13/2022,Tuesday,Fall,0
11/16/2022,2022,11,16,4,10/1/2022,11/1/2022,11/13/2022,Wednesday,Fall,0
11/17/2022,2022,11,17,4,10/1/2022,11/1/2022,11/13/2022,Thursday,Fall,0
11/18/2022,2022,11,18,4,10/1/2022,11/1/2022,11/13/2022,Friday,Fall,0
11/19/2022,2022,11,19,4,10/1/2022,11/1/2022,11/13/2022,Saturday,Fall,1
11/20/2022,2022,11,20,4,10/1/2022,11/1/2022,11/20/2022,Sunday,Fall,1
11/21/2022,2022,11,21,4,10/1/2022,11/1/2022,11/20/2022,Monday,Fall,0
11/22/2022,2022,11,22,4,10/1/2022,11/1/2022,11/20/2022,Tuesday,Fall,0
11/23/2022,2022,11,23,4,10/1/2022,11/1/2022,11/20/2022,Wednesday,Fall,0
11/24/2022,2022,11,24,4,10/1/2022,11/1/2022,11/20/2022,Thursday,Fall,0
11/25/2022,2022,11,25,4,10/1/2022,11/1/2022,11/20/2022,Friday,Fall,0
11/26/2022,2022,11,26,4,10/1/2022,11/1/2022,11/20/2022,Saturday,Fall,1
11/27/2022,2022,11,27,4,10/1/2022,11/1/2022,11/27/2022,Sunday,Fall,1
11/28/2022,2022,11,28,4,10/1/2022,11/1/2022,11/27/2022,Monday,Fall,0
11/29/2022,2022,11,29,4,10/1/2022,11/1/2022,11/27/2022,Tuesday,Fall,0
11/30/2022,2022,11,30,4,10/1/2022,11/1/2022,11/27/2022,Wednesday,Fall,0
12/1/2022,2022,12,1,4,10/1/2022,12/1/2022,11/27/2022,Thursday,Winter,0
12/2/2022,2022,12,2,4,10/1/2022,12/1/2022,11/27/2022,Friday,Winter,0
12/3/2022,2022,12,3,4,10/1/2022,12/1/2022,11/27/2022,Saturday,Winter,1
12/4/2022,2022,12,4,4,10/1/2022,12/1/2022,12/4/2022,Sunday,Winter,1
12/5/2022,2022,12,5,4,10/1/2022,12/1/2022,12/4/2022,Monday,Winter,0
12/6/2022,2022,12,6,4,10/1/2022,12/1/2022,12/4/2022,Tuesday,Winter,0
12/7/2022,2022,12,7,4,10/1/2022,12/1/2022,12/4/2022,Wednesday,Winter,0
12/8/2022,2022,12,8,4,10/1/2022,12/1/2022,12/4/2022,Thursday,Winter,0
12/9/2022,2022,12,9,4,10/1/2022,12/1/2022,12/4/2022,Friday,Winter,0
12/10/2022,2022,12,10,4,10/1/2022,12/1/2022,12/4/2022,Saturday,Winter,1
12/11/2022,2022,12,11,4,10/1/2022,12/1/2022,12/11/2022,Sunday,Winter,1
12/12/2022,2022,12,12,4,10/1/2022,12/1/2022,12/11/2022,Monday,Winter,0
12/13/2022,2022,12,13,4,10/1/2022,12/1/2022,12/11/2022,Tuesday,Winter,0
12/14/2022,2022,12,14,4,10/1/2022,12/1/2022,12/11/2022,Wednesday,Winter,0
12/15/2022,2022,12,15,4,10/1/2022,12/1/2022,12/11/2022,Thursday,Winter,0
12/16/2022,2022,12,16,4,10/1/2022,12/1/2022,12/11/2022,Friday,Winter,0
12/17/2022,2022,12,17,4,10/1/2022,12/1/2022,12/11/2022,Saturday,Winter,1
12/18/2022,2022,12,18,4,10/1/2022,12/1/2022,12/18/2022,Sunday,Winter,1
12/19/2022,2022,12,19,4,10/1/2022,12/1/2022,12/18/2022,Monday,Winter,0
12/20/2022,2022,12,20,4,10/1/2022,12/1/2022,12/18/2022,Tuesday,Winter,0
12/21/2022,2022,12,21,4,10/1/2022,12/1/2022,12/18/2022,Wednesday,Winter,0
12/22/2022,2022,12,22,4,10/1/2022,12/1/2022,12/18/2022,Thursday,Winter,0
12/23/2022,2022,12,23,4,10/1/2022,12/1/2022,12/18/2022,Friday,Winter,0
12/24/2022,2022,12,24,4,10/1/2022,12/1/2022,12/18/2022,Saturday,Winter,1
12/25/2022,2022,12,25,4,10/1/2022,12/1/2022,12/25/2022,Sunday,Winter,1
12/26/2022,2022,12,26,4,10/1/2022,12/1/2022,12/25/2022,Monday,Winter,0
12/27/2022,2022,12,27,4,10/1/2022,12/1/2022,12/25/2022,Tuesday,Winter,0
12/28/2022,2022,12,28,4,10/1/2022,12/1/2022,12/25/2022,Wednesday,Winter,0
12/29/2022,2022,12,29,4,10/1/2022,12/1/2022,12/25/2022,Thursday,Winter,0
12/30/2022,2022,12,30,4,10/1/2022,12/1/2022,12/25/2022,Friday,Winter,0
12/31/2022,2022,12,31,4,10/1/2022,12/1/2022,12/25/2022,Saturday,Winter,1
1/1/2023,2023,1,1,1,1/1/2023,1/1/2023,1/1/2023,Sunday,Winter,1
1/2/2023,2023,1,2,1,1/1/2023,1/1/2023,1/1/2023,Monday,Winter,0
1/3/2023,2023,1,3,1,1/1/2023,1/1/2023,1/1/2023,Tuesday,Winter,0
1/4/2023,2023,1,4,1,1/1/2023,1/1/2023,1/1/2023,Wednesday,Winter,0
1/5/2023,2023,1,5,1,1/1/2023,1/1/2023,1/1/2023,Thursday,Winter,0
1/6/2023,2023,1,6,1,1/1/2023,1/1/2023,1/1/2023,Friday,Winter,0
1/7/2023,2023,1,7,1,1/1/2023,1/1/2023,1/1/2023,Saturday,Winter,1
1/8/2023,2023,1,8,1,1/1/2023,1/1/2023,1/8/2023,Sunday,Winter,1
1/9/2023,2023,1,9,1,1/1/2023,1/1/2023,1/8/2023,Monday,Winter,0
1/10/2023,2023,1,10,1,1/1/2023,1/1/2023,1/8/2023,Tuesday,Winter,0
1/11/2023,2023,1,11,1,1/1/2023,1/1/2023,1/8/2023,Wednesday,Winter,0
1/12/2023,2023,1,12,1,1/1/2023,1/1/2023,1/8/2023,Thursday,Winter,0
1/13/2023,2023,1,13,1,1/1/2023,1/1/2023,1/8/2023,Friday,Winter,0
1/14/2023,2023,1,14,1,1/1/2023,1/1/2023,1/8/2023,Saturday,Winter,1
1/15/2023,2023,1,15,1,1/1/2023,1/1/2023,1/15/2023,Sunday,Winter,1
1/16/2023,2023,1,16,1,1/1/2023,1/1/2023,1/15/2023,Monday,Winter,0
1/17/2023,2023,1,17,1,1/1/2023,1/1/2023,1/15/2023,Tuesday,Winter,0
1/18/2023,2023,1,18,1,1/1/2023,1/1/2023,1/15/2023,Wednesday,Winter,0
1/19/2023,2023,1,19,1,1/1/2023,1/1/2023,1/15/2023,Thursday,Winter,0
1/20/2023,2023,1,20,1,1/1/2023,1/1/2023,1/15/2023,Friday,Winter,0
1/21/2023,2023,1,21,1,1/1/2023,1/1/2023,1/15/2023,Saturday,Winter,1
1/22/2023,2023,1,22,1,1/1/2023,1/1/2023,1/22/2023,Sunday,Winter,1
1/23/2023,2023,1,23,1,1/1/2023,1/1/2023,1/22/2023,Monday,Winter,0
1/24/2023,2023,1,24,1,1/1/2023,1/1/2023,1/22/2023,Tuesday,Winter,0
1/25/2023,2023,1,25,1,1/1/2023,1/1/2023,1/22/2023,Wednesday,Winter,0
1/26/2023,2023,1,26,1,1/1/2023,1/1/2023,1/22/2023,Thursday,Winter,0
1/27/2023,2023,1,27,1,1/1/2023,1/1/2023,1/22/2023,Friday,Winter,0
1/28/2023,2023,1,28,1,1/1/2023,1/1/2023,1/22/2023,Saturday,Winter,1
1/29/2023,2023,1,29,1,1/1/2023,1/1/2023,1/29/2023,Sunday,Winter,1
1/30/2023,2023,1,30,1,1/1/2023,1/1/2023,1/29/2023,Monday,Winter,0
1/31/2023,2023,1,31,1,1/1/2023,1/1/2023,1/29/2023,Tuesday,Winter,0
2/1/2023,2023,2,1,1,1/1/2023,2/1/2023,1/29/2023,Wednesday,Winter,0
2/2/2023,2023,2,2,1,1/1/2023,2/1/2023,1/29/2023,Thursday,Winter,0
2/3/2023,2023,2,3,1,1/1/2023,2/1/2023,1/29/2023,Friday,Winter,0
2/4/2023,2023,2,4,1,1/1/2023,2/1/2023,1/29/2023,Saturday,Winter,1
2/5/2023,2023,2,5,1,1/1/2023,2/1/2023,2/5/2023,Sunday,Winter,1
2/6/2023,2023,2,6,1,1/1/2023,2/1/2023,2/5/2023,Monday,Winter,0
2/7/2023,2023,2,7,1,1/1/2023,2/1/2023,2/5/2023,Tuesday,Winter,0
2/8/2023,2023,2,8,1,1/1/2023,2/1/2023,2/5/2023,Wednesday,Winter,0
2/9/2023,2023,2,9,1,1/1/2023,2/1/2023,2/5/2023,Thursday,Winter,0
2/10/2023,2023,2,10,1,1/1/2023,2/1/2023,2/5/2023,Friday,Winter,0
2/11/2023,2023,2,11,1,1/1/2023,2/1/2023,2/5/2023,Saturday,Winter,1
2/12/2023,2023,2,12,1,1/1/2023,2/1/2023,2/12/2023,Sunday,Winter,1
2/13/2023,2023,2,13,1,1/1/2023,2/1/2023,2/12/2023,Monday,Winter,0
2/14/2023,2023,2,14,1,1/1/2023,2/1/2023,2/12/2023,Tuesday,Winter,0
2/15/2023,2023,2,15,1,1/1/2023,2/1/2023,2/12/2023,Wednesday,Winter,0
2/16/2023,2023,2,16,1,1/1/2023,2/1/2023,2/12/2023,Thursday,Winter,0
2/17/2023,2023,2,17,1,1/1/2023,2/1/2023,2/12/2023,Friday,Winter,0
2/18/2023,2023,2,18,1,1/1/2023,2/1/2023,2/12/2023,Saturday,Winter,1
2/19/2023,2023,2,19,1,1/1/2023,2/1/2023,2/19/2023,Sunday,Winter,1
2/20/2023,2023,2,20,1,1/1/2023,2/1/2023,2/19/2023,Monday,Winter,0
2/21/2023,2023,2,21,1,1/1/2023,2/1/2023,2/19/2023,Tuesday,Winter,0
2/22/2023,2023,2,22,1,1/1/2023,2/1/2023,2/19/2023,Wednesday,Winter,0
2/23/2023,2023,2,23,1,1/1/2023,2/1/2023,2/19/2023,Thursday,Winter,0
2/24/2023,2023,2,24,1,1/1/2023,2/1/2023,2/19/2023,Friday,Winter,0
2/25/2023,2023,2,25,1,1/1/2023,2/1/2023,2/19/2023,Saturday,Winter,1
2/26/2023,2023,2,26,1,1/1/2023,2/1/2023,2/26/2023,Sunday,Winter,1
2/27/2023,2023,2,27,1,1/1/2023,2/1/2023,2/26/2023,Monday,Winter,0
2/28/2023,2023,2,28,1,1/1/2023,2/1/2023,2/26/2023,Tuesday,Winter,0
3/1/2023,2023,3,1,1,1/1/2023,3/1/2023,2/26/2023,Wednesday,Spring,0
3/2/2023,2023,3,2,1,1/1/2023,3/1/2023,2/26/2023,Thursday,Spring,0
3/3/2023,2023,3,3,1,1/1/2023,3/1/2023,2/26/2023,Friday,Spring,0
3/4/2023,2023,3,4,1,1/1/2023,3/1/2023,2/26/2023,Saturday,Spring,1
3/5/2023,2023,3,5,1,1/1/2023,3/1/2023,3/5/2023,Sunday,Spring,1
3/6/2023,2023,3,6,1,1/1/2023,3/1/2023,3/5/2023,Monday,Spring,0
3/7/2023,2023,3,7,1,1/1/2023,3/1/2023,3/5/2023,Tuesday,Spring,0
3/8/2023,2023,3,8,1,1/1/2023,3/1/2023,3/5/2023,Wednesday,Spring,0
3/9/2023,2023,3,9,1,1/1/2023,3/1/2023,3/5/2023,Thursday,Spring,0
3/10/2023,2023,3,10,1,1/1/2023,3/1/2023,3/5/2023,Friday,Spring,0
3/11/2023,2023,3,11,1,1/1/2023,3/1/2023,3/5/2023,Saturday,Spring,1
3/12/2023,2023,3,12,1,1/1/2023,3/1/2023,3/12/2023,Sunday,Spring,1
3/13/2023,2023,3,13,1,1/1/2023,3/1/2023,3/12/2023,Monday,Spring,0
3/14/2023,2023,3,14,1,1/1/2023,3/1/2023,3/12/2023,Tuesday,Spring,0
3/15/2023,2023,3,15,1,1/1/2023,3/1/2023,3/12/2023,Wednesday,Spring,0
3/16/2023,2023,3,16,1,1/1/2023,3/1/2023,3/12/2023,Thursday,Spring,0
3/17/2023,2023,3,17,1,1/1/2023,3/1/2023,3/12/2023,Friday,Spring,0
3/18/2023,2023,3,18,1,1/1/2023,3/1/2023,3/12/2023,Saturday,Spring,1
3/19/2023,2023,3,19,1,1/1/2023,3/1/2023,3/19/2023,Sunday,Spring,1
3/20/2023,2023,3,20,1,1/1/2023,3/1/2023,3/19/2023,Monday,Spring,0
3/21/2023,2023,3,21,1,1/1/2023,3/1/2023,3/19/2023,Tuesday,Spring,0
3/22/2023,2023,3,22,1,1/1/2023,3/1/2023,3/19/2023,Wednesday,Spring,0
3/23/2023,2023,3,23,1,1/1/2023,3/1/2023,3/19/2023,Thursday,Spring,0
3/24/2023,2023,3,24,1,1/1/2023,3/1/2023,3/19/2023,Friday,Spring,0
3/25/2023,2023,3,25,1,1/1/2023,3/1/2023,3/19/2023,Saturday,Spring,1
3/26/2023,2023,3,26,1,1/1/2023,3/1/2023,3/26/2023,Sunday,Spring,1
3/27/2023,2023,3,27,1,1/1/2023,3/1/2023,3/26/2023,Monday,Spring,0
3/28/2023,2023,3,28,1,1/1/2023,3/1/2023,3/26/2023,Tuesday,Spring,0
3/29/2023,2023,3,29,1,1/1/2023,3/1/2023,3/26/2023,Wednesday,Spring,0
3/30/2023,2023,3,30,1,1/1/2023,3/1/2023,3/26/2023,Thursday,Spring,0
3/31/2023,2023,3,31,1,1/1/2023,3/1/2023,3/26/2023,Friday,Spring,0
4/1/2023,2023,4,1,1,4/1/2023,4/1/2023,3/26/2023,Saturday,Spring,1
4/2/2023,2023,4,2,2,4/1/2023,4/1/2023,4/2/2023,Sunday,Spring,1
4/3/2023,2023,4,3,2,4/1/2023,4/1/2023,4/2/2023,Monday,Spring,0
4/4/2023,2023,4,4,2,4/1/2023,4/1/2023,4/2/2023,Tuesday,Spring,0
4/5/2023,2023,4,5,2,4/1/2023,4/1/2023,4/2/2023,Wednesday,Spring,0
4/6/2023,2023,4,6,2,4/1/2023,4/1/2023,4/2/2023,Thursday,Spring,0
4/7/2023,2023,4,7,2,4/1/2023,4/1/2023,4/2/2023,Friday,Spring,0
4/8/2023,2023,4,8,2,4/1/2023,4/1/2023,4/2/2023,Saturday,Spring,1
4/9/2023,2023,4,9,2,4/1/2023,4/1/2023,4/9/2023,Sunday,Spring,1
4/10/2023,2023,4,10,2,4/1/2023,4/1/2023,4/9/2023,Monday,Spring,0
4/11/2023,2023,4,11,2,4/1/2023,4/1/2023,4/9/2023,Tuesday,Spring,0
4/12/2023,2023,4,12,2,4/1/2023,4/1/2023,4/9/2023,Wednesday,Spring,0
4/13/2023,2023,4,13,2,4/1/2023,4/1/2023,4/9/2023,Thursday,Spring,0
4/14/2023,2023,4,14,2,4/1/2023,4/1/2023,4/9/2023,Friday,Spring,0
4/15/2023,2023,4,15,2,4/1/2023,4/1/2023,4/9/2023,Saturday,Spring,1
4/16/2023,2023,4,16,2,4/1/2023,4/1/2023,4/16/2023,Sunday,Spring,1
4/17/2023,2023,4,17,2,4/1/2023,4/1/2023,4/16/2023,Monday,Spring,0
4/18/2023,2023,4,18,2,4/1/2023,4/1/2023,4/16/2023,Tuesday,Spring,0
4/19/2023,2023,4,19,2,4/1/2023,4/1/2023,4/16/2023,Wednesday,Spring,0
4/20/2023,2023,4,20,2,4/1/2023,4/1/2023,4/16/2023,Thursday,Spring,0
4/21/2023,2023,4,21,2,4/1/2023,4/1/2023,4/16/2023,Friday,Spring,0
4/22/2023,2023,4,22,2,4/1/2023,4/1/2023,4/16/2023,Saturday,Spring,1
4/23/2023,2023,4,23,2,4/1/2023,4/1/2023,4/23/2023,Sunday,Spring,1
4/24/2023,2023,4,24,2,4/1/2023,4/1/2023,4/23/2023,Monday,Spring,0
4/25/2023,2023,4,25,2,4/1/2023,4/1/2023,4/23/2023,Tuesday,Spring,0
4/26/2023,2023,4,26,2,4/1/2023,4/1/2023,4/23/2023,Wednesday,Spring,0
4/27/2023,2023,4,27,2,4/1/2023,4/1/2023,4/23/2023,Thursday,Spring,0
4/28/2023,2023,4,28,2,4/1/2023,4/1/2023,4/23/2023,Friday,Spring,0
4/29/2023,2023,4,29,2,4/1/2023,4/1/2023,4/23/2023,Saturday,Spring,1
4/30/2023,2023,4,30,2,4/1/2023,4/1/2023,4/30/2023,Sunday,Spring,1
5/1/2023,2023,5,1,2,4/1/2023,5/1/2023,4/30/2023,Monday,Spring,0
5/2/2023,2023,5,2,2,4/1/2023,5/1/2023,4/30/2023,Tuesday,Spring,0
5/3/2023,2023,5,3,2,4/1/2023,5/1/2023,4/30/2023,Wednesday,Spring,0
5/4/2023,2023,5,4,2,4/1/2023,5/1/2023,4/30/2023,Thursday,Spring,0
5/5/2023,2023,5,5,2,4/1/2023,5/1/2023,4/30/2023,Friday,Spring,0
5/6/2023,2023,5,6,2,4/1/2023,5/1/2023,4/30/2023,Saturday,Spring,1
5/7/2023,2023,5,7,2,4/1/2023,5/1/2023,5/7/2023,Sunday,Spring,1
5/8/2023,2023,5,8,2,4/1/2023,5/1/2023,5/7/2023,Monday,Spring,0
5/9/2023,2023,5,9,2,4/1/2023,5/1/2023,5/7/2023,Tuesday,Spring,0
5/10/2023,2023,5,10,2,4/1/2023,5/1/2023,5/7/2023,Wednesday,Spring,0
5/11/2023,2023,5,11,2,4/1/2023,5/1/2023,5/7/2023,Thursday,Spring,0
5/12/2023,2023,5,12,2,4/1/2023,5/1/2023,5/7/2023,Friday,Spring,0
5/13/2023,2023,5,13,2,4/1/2023,5/1/2023,5/7/2023,Saturday,Spring,1
5/14/2023,2023,5,14,2,4/1/2023,5/1/2023,5/14/2023,Sunday,Spring,1
5/15/2023,2023,5,15,2,4/1/2023,5/1/2023,5/14/2023,Monday,Spring,0
5/16/2023,2023,5,16,2,4/1/2023,5/1/2023,5/14/2023,Tuesday,Spring,0
5/17/2023,2023,5,17,2,4/1/2023,5/1/2023,5/14/2023,Wednesday,Spring,0
5/18/2023,2023,5,18,2,4/1/2023,5/1/2023,5/14/2023,Thursday,Spring,0
5/19/2023,2023,5,19,2,4/1/2023,5/1/2023,5/14/2023,Friday,Spring,0
5/20/2023,2023,5,20,2,4/1/2023,5/1/2023,5/14/2023,Saturday,Spring,1
5/21/2023,2023,5,21,2,4/1/2023,5/1/2023,5/21/2023,Sunday,Spring,1
5/22/2023,2023,5,22,2,4/1/2023,5/1/2023,5/21/2023,Monday,Spring,0
5/23/2023,2023,5,23,2,4/1/2023,5/1/2023,5/21/2023,Tuesday,Spring,0
5/24/2023,2023,5,24,2,4/1/2023,5/1/2023,5/21/2023,Wednesday,Spring,0
5/25/2023,2023,5,25,2,4/1/2023,5/1/2023,5/21/2023,Thursday,Spring,0
5/26/2023,2023,5,26,2,4/1/2023,5/1/2023,5/21/2023,Friday,Spring,0
5/27/2023,2023,5,27,2,4/1/2023,5/1/2023,5/21/2023,Saturday,Spring,1
5/28/2023,2023,5,28,2,4/1/2023,5/1/2023,5/28/2023,Sunday,Spring,1
5/29/2023,2023,5,29,2,4/1/2023,5/1/2023,5/28/2023,Monday,Spring,0
5/30/2023,2023,5,30,2,4/1/2023,5/1/2023,5/28/2023,Tuesday,Spring,0
5/31/2023,2023,5,31,2,4/1/2023,5/1/2023,5/28/2023,Wednesday,Spring,0
6/1/2023,2023,6,1,2,4/1/2023,6/1/2023,5/28/2023,Thursday,Summer,0
6/2/2023,2023,6,2,2,4/1/2023,6/1/2023,5/28/2023,Friday,Summer,0
6/3/2023,2023,6,3,2,4/1/2023,6/1/2023,5/28/2023,Saturday,Summer,1
6/4/2023,2023,6,4,2,4/1/2023,6/1/2023,6/4/2023,Sunday,Summer,1
6/5/2023,2023,6,5,2,4/1/2023,6/1/2023,6/4/2023,Monday,Summer,0
6/6/2023,2023,6,6,2,4/1/2023,6/1/2023,6/4/2023,Tuesday,Summer,0
6/7/2023,2023,6,7,2,4/1/2023,6/1/2023,6/4/2023,Wednesday,Summer,0
6/8/2023,2023,6,8,2,4/1/2023,6/1/2023,6/4/2023,Thursday,Summer,0
6/9/2023,2023,6,9,2,4/1/2023,6/1/2023,6/4/2023,Friday,Summer,0
6/10/2023,2023,6,10,2,4/1/2023,6/1/2023,6/4/2023,Saturday,Summer,1
6/11/2023,2023,6,11,2,4/1/2023,6/1/2023,6/11/2023,Sunday,Summer,1
6/12/2023,2023,6,12,2,4/1/2023,6/1/2023,6/11/2023,Monday,Summer,0
6/13/2023,2023,6,13,2,4/1/2023,6/1/2023,6/11/2023,Tuesday,Summer,0
6/14/2023,2023,6,14,2,4/1/2023,6/1/2023,6/11/2023,Wednesday,Summer,0
6/15/2023,2023,6,15,2,4/1/2023,6/1/2023,6/11/2023,Thursday,Summer,0
6/16/2023,2023,6,16,2,4/1/2023,6/1/2023,6/11/2023,Friday,Summer,0
6/17/2023,2023,6,17,2,4/1/2023,6/1/2023,6/11/2023,Saturday,Summer,1
6/18/2023,2023,6,18,2,4/1/2023,6/1/2023,6/18/2023,Sunday,Summer,1
6/19/2023,2023,6,19,2,4/1/2023,6/1/2023,6/18/2023,Monday,Summer,0
6/20/2023,2023,6,20,2,4/1/2023,6/1/2023,6/18/2023,Tuesday,Summer,0
6/21/2023,2023,6,21,2,4/1/2023,6/1/2023,6/18/2023,Wednesday,Summer,0
6/22/2023,2023,6,22,2,4/1/2023,6/1/2023,6/18/2023,Thursday,Summer,0
6/23/2023,2023,6,23,2,4/1/2023,6/1/2023,6/18/2023,Friday,Summer,0
6/24/2023,2023,6,24,2,4/1/2023,6/1/2023,6/18/2023,Saturday,Summer,1
6/25/2023,2023,6,25,2,4/1/2023,6/1/2023,6/25/2023,Sunday,Summer,1
6/26/2023,2023,6,26,2,4/1/2023,6/1/2023,6/25/2023,Monday,Summer,0
6/27/2023,2023,6,27,2,4/1/2023,6/1/2023,6/25/2023,Tuesday,Summer,0
6/28/2023,2023,6,28,2,4/1/2023,6/1/2023,6/25/2023,Wednesday,Summer,0
6/29/2023,2023,6,29,2,4/1/2023,6/1/2023,6/25/2023,Thursday,Summer,0
6/30/2023,2023,6,30,2,4/1/2023,6/1/2023,6/25/2023,Friday,Summer,0
7/1/2023,2023,7,1,2,7/1/2023,7/1/2023,6/25/2023,Saturday,Summer,1
7/2/2023,2023,7,2,3,7/1/2023,7/1/2023,7/2/2023,Sunday,Summer,1
7/3/2023,2023,7,3,3,7/1/2023,7/1/2023,7/2/2023,Monday,Summer,0
7/4/2023,2023,7,4,3,7/1/2023,7/1/2023,7/2/2023,Tuesday,Summer,0
7/5/2023,2023,7,5,3,7/1/2023,7/1/2023,7/2/2023,Wednesday,Summer,0
7/6/2023,2023,7,6,3,7/1/2023,7/1/2023,7/2/2023,Thursday,Summer,0
7/7/2023,2023,7,7,3,7/1/2023,7/1/2023,7/2/2023,Friday,Summer,0
7/8/2023,2023,7,8,3,7/1/2023,7/1/2023,7/2/2023,Saturday,Summer,1
7/9/2023,2023,7,9,3,7/1/2023,7/1/2023,7/9/2023,Sunday,Summer,1
7/10/2023,2023,7,10,3,7/1/2023,7/1/2023,7/9/2023,Monday,Summer,0
7/11/2023,2023,7,11,3,7/1/2023,7/1/2023,7/9/2023,Tuesday,Summer,0
7/12/2023,2023,7,12,3,7/1/2023,7/1/2023,7/9/2023,Wednesday,Summer,0
7/13/2023,2023,7,13,3,7/1/2023,7/1/2023,7/9/2023,Thursday,Summer,0
7/14/2023,2023,7,14,3,7/1/2023,7/1/2023,7/9/2023,Friday,Summer,0
7/15/2023,2023,7,15,3,7/1/2023,7/1/2023,7/9/2023,Saturday,Summer,1
7/16/2023,2023,7,16,3,7/1/2023,7/1/2023,7/16/2023,Sunday,Summer,1
7/17/2023,2023,7,17,3,7/1/2023,7/1/2023,7/16/2023,Monday,Summer,0
7/18/2023,2023,7,18,3,7/1/2023,7/1/2023,7/16/2023,Tuesday,Summer,0
7/19/2023,2023,7,19,3,7/1/2023,7/1/2023,7/16/2023,Wednesday,Summer,0
7/20/2023,2023,7,20,3,7/1/2023,7/1/2023,7/16/2023,Thursday,Summer,0
7/21/2023,2023,7,21,3,7/1/2023,7/1/2023,7/16/2023,Friday,Summer,0
7/22/2023,2023,7,22,3,7/1/2023,7/1/2023,7/16/2023,Saturday,Summer,1
7/23/2023,2023,7,23,3,7/1/2023,7/1/2023,7/23/2023,Sunday,Summer,1
7/24/2023,2023,7,24,3,7/1/2023,7/1/2023,7/23/2023,Monday,Summer,0
7/25/2023,2023,7,25,3,7/1/2023,7/1/2023,7/23/2023,Tuesday,Summer,0
7/26/2023,2023,7,26,3,7/1/2023,7/1/2023,7/23/2023,Wednesday,Summer,0
7/27/2023,2023,7,27,3,7/1/2023,7/1/2023,7/23/2023,Thursday,Summer,0
7/28/2023,2023,7,28,3,7/1/2023,7/1/2023,7/23/2023,Friday,Summer,0
7/29/2023,2023,7,29,3,7/1/2023,7/1/2023,7/23/2023,Saturday,Summer,1
7/30/2023,2023,7,30,3,7/1/2023,7/1/2023,7/30/2023,Sunday,Summer,1
7/31/2023,2023,7,31,3,7/1/2023,7/1/2023,7/30/2023,Monday,Summer,0
8/1/2023,2023,8,1,3,7/1/2023,8/1/2023,7/30/2023,Tuesday,Summer,0
8/2/2023,2023,8,2,3,7/1/2023,8/1/2023,7/30/2023,Wednesday,Summer,0
8/3/2023,2023,8,3,3,7/1/2023,8/1/2023,7/30/2023,Thursday,Summer,0
8/4/2023,2023,8,4,3,7/1/2023,8/1/2023,7/30/2023,Friday,Summer,0
8/5/2023,2023,8,5,3,7/1/2023,8/1/2023,7/30/2023,Saturday,Summer,1
8/6/2023,2023,8,6,3,7/1/2023,8/1/2023,8/6/2023,Sunday,Summer,1
8/7/2023,2023,8,7,3,7/1/2023,8/1/2023,8/6/2023,Monday,Summer,0
8/8/2023,2023,8,8,3,7/1/2023,8/1/2023,8/6/2023,Tuesday,Summer,0
8/9/2023,2023,8,9,3,7/1/2023,8/1/2023,8/6/2023,Wednesday,Summer,0
8/10/2023,2023,8,10,3,7/1/2023,8/1/2023,8/6/2023,Thursday,Summer,0
8/11/2023,2023,8,11,3,7/1/2023,8/1/2023,8/6/2023,Friday,Summer,0
8/12/2023,2023,8,12,3,7/1/2023,8/1/2023,8/6/2023,Saturday,Summer,1
8/13/2023,2023,8,13,3,7/1/2023,8/1/2023,8/13/2023,Sunday,Summer,1
8/14/2023,2023,8,14,3,7/1/2023,8/1/2023,8/13/2023,Monday,Summer,0
8/15/2023,2023,8,15,3,7/1/2023,8/1/2023,8/13/2023,Tuesday,Summer,0
8/16/2023,2023,8,16,3,7/1/2023,8/1/2023,8/13/2023,Wednesday,Summer,0
8/17/2023,2023,8,17,3,7/1/2023,8/1/2023,8/13/2023,Thursday,Summer,0
8/18/2023,2023,8,18,3,7/1/2023,8/1/2023,8/13/2023,Friday,Summer,0
8/19/2023,2023,8,19,3,7/1/2023,8/1/2023,8/13/2023,Saturday,Summer,1
8/20/2023,2023,8,20,3,7/1/2023,8/1/2023,8/20/2023,Sunday,Summer,1
8/21/2023,2023,8,21,3,7/1/2023,8/1/2023,8/20/2023,Monday,Summer,0
8/22/2023,2023,8,22,3,7/1/2023,8/1/2023,8/20/2023,Tuesday,Summer,0
8/23/2023,2023,8,23,3,7/1/2023,8/1/2023,8/20/2023,Wednesday,Summer,0
8/24/2023,2023,8,24,3,7/1/2023,8/1/2023,8/20/2023,Thursday,Summer,0
8/25/2023,2023,8,25,3,7/1/2023,8/1/2023,8/20/2023,Friday,Summer,0
8/26/2023,2023,8,26,3,7/1/2023,8/1/2023,8/20/2023,Saturday,Summer,1
8/27/2023,2023,8,27,3,7/1/2023,8/1/2023,8/27/2023,Sunday,Summer,1
8/28/2023,2023,8,28,3,7/1/2023,8/1/2023,8/27/2023,Monday,Summer,0
8/29/2023,2023,8,29,3,7/1/2023,8/1/2023,8/27/2023,Tuesday,Summer,0
8/30/2023,2023,8,30,3,7/1/2023,8/1/2023,8/27/2023,Wednesday,Summer,0
8/31/2023,2023,8,31,3,7/1/2023,8/1/2023,8/27/2023,Thursday,Summer,0
9/1/2023,2023,9,1,3,7/1/2023,9/1/2023,8/27/2023,Friday,Fall,0
9/2/2023,2023,9,2,3,7/1/2023,9/1/2023,8/27/2023,Saturday,Fall,1
9/3/2023,2023,9,3,3,7/1/2023,9/1/2023,9/3/2023,Sunday,Fall,1
9/4/2023,2023,9,4,3,7/1/2023,9/1/2023,9/3/2023,Monday,Fall,0
9/5/2023,2023,9,5,3,7/1/2023,9/1/2023,9/3/2023,Tuesday,Fall,0
9/6/2023,2023,9,6,3,7/1/2023,9/1/2023,9/3/2023,Wednesday,Fall,0
9/7/2023,2023,9,7,3,7/1/2023,9/1/2023,9/3/2023,Thursday,Fall,0
9/8/2023,2023,9,8,3,7/1/2023,9/1/2023,9/3/2023,Friday,Fall,0
9/9/2023,2023,9,9,3,7/1/2023,9/1/2023,9/3/2023,Saturday,Fall,1
9/10/2023,2023,9,10,3,7/1/2023,9/1/2023,9/10/2023,Sunday,Fall,1
9/11/2023,2023,9,11,3,7/1/2023,9/1/2023,9/10/2023,Monday,Fall,0
9/12/2023,2023,9,12,3,7/1/2023,9/1/2023,9/10/2023,Tuesday,Fall,0
9/13/2023,2023,9,13,3,7/1/2023,9/1/2023,9/10/2023,Wednesday,Fall,0
9/14/2023,2023,9,14,3,7/1/2023,9/1/2023,9/10/2023,Thursday,Fall,0
9/15/2023,2023,9,15,3,7/1/2023,9/1/2023,9/10/2023,Friday,Fall,0
9/16/2023,2023,9,16,3,7/1/2023,9/1/2023,9/10/2023,Saturday,Fall,1
9/17/2023,2023,9,17,3,7/1/2023,9/1/2023,9/17/2023,Sunday,Fall,1
9/18/2023,2023,9,18,3,7/1/2023,9/1/2023,9/17/2023,Monday,Fall,0
9/19/2023,2023,9,19,3,7/1/2023,9/1/2023,9/17/2023,Tuesday,Fall,0
9/20/2023,2023,9,20,3,7/1/2023,9/1/2023,9/17/2023,Wednesday,Fall,0
9/21/2023,2023,9,21,3,7/1/2023,9/1/2023,9/17/2023,Thursday,Fall,0
9/22/2023,2023,9,22,3,7/1/2023,9/1/2023,9/17/2023,Friday,Fall,0
9/23/2023,2023,9,23,3,7/1/2023,9/1/2023,9/17/2023,Saturday,Fall,1
9/24/2023,2023,9,24,3,7/1/2023,9/1/2023,9/24/2023,Sunday,Fall,1
9/25/2023,2023,9,25,3,7/1/2023,9/1/2023,9/24/2023,Monday,Fall,0
9/26/2023,2023,9,26,3,7/1/2023,9/1/2023,9/24/2023,Tuesday,Fall,0
9/27/2023,2023,9,27,3,7/1/2023,9/1/2023,9/24/2023,Wednesday,Fall,0
9/28/2023,2023,9,28,3,7/1/2023,9/1/2023,9/24/2023,Thursday,Fall,0
9/29/2023,2023,9,29,3,7/1/2023,9/1/2023,9/24/2023,Friday,Fall,0
9/30/2023,2023,9,30,3,7/1/2023,9/1/2023,9/24/2023,Saturday,Fall,1
10/1/2023,2023,10,1,4,10/1/2023,10/1/2023,10/1/2023,Sunday,Fall,1
10/2/2023,2023,10,2,4,10/1/2023,10/1/2023,10/1/2023,Monday,Fall,0
10/3/2023,2023,10,3,4,10/1/2023,10/1/2023,10/1/2023,Tuesday,Fall,0
10/4/2023,2023,10,4,4,10/1/2023,10/1/2023,10/1/2023,Wednesday,Fall,0
10/5/2023,2023,10,5,4,10/1/2023,10/1/2023,10/1/2023,Thursday,Fall,0
10/6/2023,2023,10,6,4,10/1/2023,10/1/2023,10/1/2023,Friday,Fall,0
10/7/2023,2023,10,7,4,10/1/2023,10/1/2023,10/1/2023,Saturday,Fall,1
10/8/2023,2023,10,8,4,10/1/2023,10/1/2023,10/8/2023,Sunday,Fall,1
10/9/2023,2023,10,9,4,10/1/2023,10/1/2023,10/8/2023,Monday,Fall,0
10/10/2023,2023,10,10,4,10/1/2023,10/1/2023,10/8/2023,Tuesday,Fall,0
10/11/2023,2023,10,11,4,10/1/2023,10/1/2023,10/8/2023,Wednesday,Fall,0
10/12/2023,2023,10,12,4,10/1/2023,10/1/2023,10/8/2023,Thursday,Fall,0
10/13/2023,2023,10,13,4,10/1/2023,10/1/2023,10/8/2023,Friday,Fall,0
10/14/2023,2023,10,14,4,10/1/2023,10/1/2023,10/8/2023,Saturday,Fall,1
10/15/2023,2023,10,15,4,10/1/2023,10/1/2023,10/15/2023,Sunday,Fall,1
10/16/2023,2023,10,16,4,10/1/2023,10/1/2023,10/15/2023,Monday,Fall,0
10/17/2023,2023,10,17,4,10/1/2023,10/1/2023,10/15/2023,Tuesday,Fall,0
10/18/2023,2023,10,18,4,10/1/2023,10/1/2023,10/15/2023,Wednesday,Fall,0
10/19/2023,2023,10,19,4,10/1/2023,10/1/2023,10/15/2023,Thursday,Fall,0
10/20/2023,2023,10,20,4,10/1/2023,10/1/2023,10/15/2023,Friday,Fall,0
10/21/2023,2023,10,21,4,10/1/2023,10/1/2023,10/15/2023,Saturday,Fall,1
10/22/2023,2023,10,22,4,10/1/2023,10/1/2023,10/22/2023,Sunday,Fall,1
10/23/2023,2023,10,23,4,10/1/2023,10/1/2023,10/22/2023,Monday,Fall,0
10/24/2023,2023,10,24,4,10/1/2023,10/1/2023,10/22/2023,Tuesday,Fall,0
10/25/2023,2023,10,25,4,10/1/2023,10/1/2023,10/22/2023,Wednesday,Fall,0
10/26/2023,2023,10,26,4,10/1/2023,10/1/2023,10/22/2023,Thursday,Fall,0
10/27/2023,2023,10,27,4,10/1/2023,10/1/2023,10/22/2023,Friday,Fall,0
10/28/2023,2023,10,28,4,10/1/2023,10/1/2023,10/22/2023,Saturday,Fall,1
10/29/2023,2023,10,29,4,10/1/2023,10/1/2023,10/29/2023,Sunday,Fall,1
10/30/2023,2023,10,30,4,10/1/2023,10/1/2023,10/29/2023,Monday,Fall,0
10/31/2023,2023,10,31,4,10/1/2023,10/1/2023,10/29/2023,Tuesday,Fall,0
11/1/2023,2023,11,1,4,10/1/2023,11/1/2023,10/29/2023,Wednesday,Fall,0
11/2/2023,2023,11,2,4,10/1/2023,11/1/2023,10/29/2023,Thursday,Fall,0
11/3/2023,2023,11,3,4,10/1/2023,11/1/2023,10/29/2023,Friday,Fall,0
11/4/2023,2023,11,4,4,10/1/2023,11/1/2023,10/29/2023,Saturday,Fall,1
11/5/2023,2023,11,5,4,10/1/2023,11/1/2023,11/5/2023,Sunday,Fall,1
11/6/2023,2023,11,6,4,10/1/2023,11/1/2023,11/5/2023,Monday,Fall,0
11/7/2023,2023,11,7,4,10/1/2023,11/1/2023,11/5/2023,Tuesday,Fall,0
11/8/2023,2023,11,8,4,10/1/2023,11/1/2023,11/5/2023,Wednesday,Fall,0
11/9/2023,2023,11,9,4,10/1/2023,11/1/2023,11/5/2023,Thursday,Fall,0
11/10/2023,2023,11,10,4,10/1/2023,11/1/2023,11/5/2023,Friday,Fall,0
11/11/2023,2023,11,11,4,10/1/2023,11/1/2023,11/5/2023,Saturday,Fall,1
11/12/2023,2023,11,12,4,10/1/2023,11/1/2023,11/12/2023,Sunday,Fall,1
11/13/2023,2023,11,13,4,10/1/2023,11/1/2023,11/12/2023,Monday,Fall,0
11/14/2023,2023,11,14,4,10/1/2023,11/1/2023,11/12/2023,Tuesday,Fall,0
11/15/2023,2023,11,15,4,10/1/2023,11/1/2023,11/12/2023,Wednesday,Fall,0
11/16/2023,2023,11,16,4,10/1/2023,11/1/2023,11/12/2023,Thursday,Fall,0
11/17/2023,2023,11,17,4,10/1/2023,11/1/2023,11/12/2023,Friday,Fall,0
11/18/2023,2023,11,18,4,10/1/2023,11/1/2023,11/12/2023,Saturday,Fall,1
11/19/2023,2023,11,19,4,10/1/2023,11/1/2023,11/19/2023,Sunday,Fall,1
11/20/2023,2023,11,20,4,10/1/2023,11/1/2023,11/19/2023,Monday,Fall,0
11/21/2023,2023,11,21,4,10/1/2023,11/1/2023,11/19/2023,Tuesday,Fall,0
11/22/2023,2023,11,22,4,10/1/2023,11/1/2023,11/19/2023,Wednesday,Fall,0
11/23/2023,2023,11,23,4,10/1/2023,11/1/2023,11/19/2023,Thursday,Fall,0
11/24/2023,2023,11,24,4,10/1/2023,11/1/2023,11/19/2023,Friday,Fall,0
11/25/2023,2023,11,25,4,10/1/2023,11/1/2023,11/19/2023,Saturday,Fall,1
11/26/2023,2023,11,26,4,10/1/2023,11/1/2023,11/26/2023,Sunday,Fall,1
11/27/2023,2023,11,27,4,10/1/2023,11/1/2023,11/26/2023,Monday,Fall,0
11/28/2023,2023,11,28,4,10/1/2023,11/1/2023,11/26/2023,Tuesday,Fall,0
11/29/2023,2023,11,29,4,10/1/2023,11/1/2023,11/26/2023,Wednesday,Fall,0
11/30/2023,2023,11,30,4,10/1/2023,11/1/2023,11/26/2023,Thursday,Fall,0
12/1/2023,2023,12,1,4,10/1/2023,12/1/2023,11/26/2023,Friday,Winter,0
12/2/2023,2023,12,2,4,10/1/2023,12/1/2023,11/26/2023,Saturday,Winter,1
12/3/2023,2023,12,3,4,10/1/2023,12/1/2023,12/3/2023,Sunday,Winter,1
12/4/2023,2023,12,4,4,10/1/2023,12/1/2023,12/3/2023,Monday,Winter,0
12/5/2023,2023,12,5,4,10/1/2023,12/1/2023,12/3/2023,Tuesday,Winter,0
12/6/2023,2023,12,6,4,10/1/2023,12/1/2023,12/3/2023,Wednesday,Winter,0
12/7/2023,2023,12,7,4,10/1/2023,12/1/2023,12/3/2023,Thursday,Winter,0
12/8/2023,2023,12,8,4,10/1/2023,12/1/2023,12/3/2023,Friday,Winter,0
12/9/2023,2023,12,9,4,10/1/2023,12/1/2023,12/3/2023,Saturday,Winter,1
12/10/2023,2023,12,10,4,10/1/2023,12/1/2023,12/10/2023,Sunday,Winter,1
12/11/2023,2023,12,11,4,10/1/2023,12/1/2023,12/10/2023,Monday,Winter,0
12/12/2023,2023,12,12,4,10/1/2023,12/1/2023,12/10/2023,Tuesday,Winter,0
12/13/2023,2023,12,13,4,10/1/2023,12/1/2023,12/10/2023,Wednesday,Winter,0
12/14/2023,2023,12,14,4,10/1/2023,12/1/2023,12/10/2023,Thursday,Winter,0
12/15/2023,2023,12,15,4,10/1/2023,12/1/2023,12/10/2023,Friday,Winter,0
12/16/2023,2023,12,16,4,10/1/2023,12/1/2023,12/10/2023,Saturday,Winter,1
12/17/2023,2023,12,17,4,10/1/2023,12/1/2023,12/17/2023,Sunday,Winter,1
12/18/2023,2023,12,18,4,10/1/2023,12/1/2023,12/17/2023,Monday,Winter,0
12/19/2023,2023,12,19,4,10/1/2023,12/1/2023,12/17/2023,Tuesday,Winter,0
12/20/2023,2023,12,20,4,10/1/2023,12/1/2023,12/17/2023,Wednesday,Winter,0
12/21/2023,2023,12,21,4,10/1/2023,12/1/2023,12/17/2023,Thursday,Winter,0
12/22/2023,2023,12,22,4,10/1/2023,12/1/2023,12/17/2023,Friday,Winter,0
12/23/2023,2023,12,23,4,10/1/2023,12/1/2023,12/17/2023,Saturday,Winter,1
12/24/2023,2023,12,24,4,10/1/2023,12/1/2023,12/24/2023,Sunday,Winter,1
12/25/2023,2023,12,25,4,10/1/2023,12/1/2023,12/24/2023,Monday,Winter,0
12/26/2023,2023,12,26,4,10/1/2023,12/1/2023,12/24/2023,Tuesday,Winter,0
12/27/2023,2023,12,27,4,10/1/2023,12/1/2023,12/24/2023,Wednesday,Winter,0
12/28/2023,2023,12,28,4,10/1/2023,12/1/2023,12/24/2023,Thursday,Winter,0
12/29/2023,2023,12,29,4,10/1/2023,12/1/2023,12/24/2023,Friday,Winter,0
12/30/2023,2023,12,30,4,10/1/2023,12/1/2023,12/24/2023,Saturday,Winter,1
12/31/2023,2023,12,31,4,10/1/2023,12/1/2023,12/31/2023,Sunday,Winter,1
1/1/2024,2024,1,1,4,1/1/2024,1/1/2024,12/31/2023,Monday,Winter,0
1/2/2024,2024,1,2,4,1/1/2024,1/1/2024,12/31/2023,Tuesday,Winter,0
1/3/2024,2024,1,3,4,1/1/2024,1/1/2024,12/31/2023,Wednesday,Winter,0
1/4/2024,2024,1,4,4,1/1/2024,1/1/2024,12/31/2023,Thursday,Winter,0
1/5/2024,2024,1,5,4,1/1/2024,1/1/2024,12/31/2023,Friday,Winter,0
1/6/2024,2024,1,6,4,1/1/2024,1/1/2024,12/31/2023,Saturday,Winter,1
1/7/2024,2024,1,7,1,1/1/2024,1/1/2024,1/7/2024,Sunday,Winter,1
1/8/2024,2024,1,8,1,1/1/2024,1/1/2024,1/7/2024,Monday,Winter,0
1/9/2024,2024,1,9,1,1/1/2024,1/1/2024,1/7/2024,Tuesday,Winter,0
1/10/2024,2024,1,10,1,1/1/2024,1/1/2024,1/7/2024,Wednesday,Winter,0
1/11/2024,2024,1,11,1,1/1/2024,1/1/2024,1/7/2024,Thursday,Winter,0
1/12/2024,2024,1,12,1,1/1/2024,1/1/2024,1/7/2024,Friday,Winter,0
1/13/2024,2024,1,13,1,1/1/2024,1/1/2024,1/7/2024,Saturday,Winter,1
1/14/2024,2024,1,14,1,1/1/2024,1/1/2024,1/14/2024,Sunday,Winter,1
1/15/2024,2024,1,15,1,1/1/2024,1/1/2024,1/14/2024,Monday,Winter,0
1/16/2024,2024,1,16,1,1/1/2024,1/1/2024,1/14/2024,Tuesday,Winter,0
1/17/2024,2024,1,17,1,1/1/2024,1/1/2024,1/14/2024,Wednesday,Winter,0
1/18/2024,2024,1,18,1,1/1/2024,1/1/2024,1/14/2024,Thursday,Winter,0
1/19/2024,2024,1,19,1,1/1/2024,1/1/2024,1/14/2024,Friday,Winter,0
1/20/2024,2024,1,20,1,1/1/2024,1/1/2024,1/14/2024,Saturday,Winter,1
1/21/2024,2024,1,21,1,1/1/2024,1/1/2024,1/21/2024,Sunday,Winter,1
1/22/2024,2024,1,22,1,1/1/2024,1/1/2024,1/21/2024,Monday,Winter,0
1/23/2024,2024,1,23,1,1/1/2024,1/1/2024,1/21/2024,Tuesday,Winter,0
1/24/2024,2024,1,24,1,1/1/2024,1/1/2024,1/21/2024,Wednesday,Winter,0
1/25/2024,2024,1,25,1,1/1/2024,1/1/2024,1/21/2024,Thursday,Winter,0
1/26/2024,2024,1,26,1,1/1/2024,1/1/2024,1/21/2024,Friday,Winter,0
1/27/2024,2024,1,27,1,1/1/2024,1/1/2024,1/21/2024,Saturday,Winter,1
1/28/2024,2024,1,28,1,1/1/2024,1/1/2024,1/28/2024,Sunday,Winter,1
1/29/2024,2024,1,29,1,1/1/2024,1/1/2024,1/28/2024,Monday,Winter,0
1/30/2024,2024,1,30,1,1/1/2024,1/1/2024,1/28/2024,Tuesday,Winter,0
1/31/2024,2024,1,31,1,1/1/2024,1/1/2024,1/28/2024,Wednesday,Winter,0
2/1/2024,2024,2,1,1,1/1/2024,2/1/2024,1/28/2024,Thursday,Winter,0
2/2/2024,2024,2,2,1,1/1/2024,2/1/2024,1/28/2024,Friday,Winter,0
2/3/2024,2024,2,3,1,1/1/2024,2/1/2024,1/28/2024,Saturday,Winter,1
2/4/2024,2024,2,4,1,1/1/2024,2/1/2024,2/4/2024,Sunday,Winter,1
2/5/2024,2024,2,5,1,1/1/2024,2/1/2024,2/4/2024,Monday,Winter,0
2/6/2024,2024,2,6,1,1/1/2024,2/1/2024,2/4/2024,Tuesday,Winter,0
2/7/2024,2024,2,7,1,1/1/2024,2/1/2024,2/4/2024,Wednesday,Winter,0
2/8/2024,2024,2,8,1,1/1/2024,2/1/2024,2/4/2024,Thursday,Winter,0
2/9/2024,2024,2,9,1,1/1/2024,2/1/2024,2/4/2024,Friday,Winter,0
2/10/2024,2024,2,10,1,1/1/2024,2/1/2024,2/4/2024,Saturday,Winter,1
2/11/2024,2024,2,11,1,1/1/2024,2/1/2024,2/11/2024,Sunday,Winter,1
2/12/2024,2024,2,12,1,1/1/2024,2/1/2024,2/11/2024,Monday,Winter,0
2/13/2024,2024,2,13,1,1/1/2024,2/1/2024,2/11/2024,Tuesday,Winter,0
2/14/2024,2024,2,14,1,1/1/2024,2/1/2024,2/11/2024,Wednesday,Winter,0
2/15/2024,2024,2,15,1,1/1/2024,2/1/2024,2/11/2024,Thursday,Winter,0
2/16/2024,2024,2,16,1,1/1/2024,2/1/2024,2/11/2024,Friday,Winter,0
2/17/2024,2024,2,17,1,1/1/2024,2/1/2024,2/11/2024,Saturday,Winter,1
2/18/2024,2024,2,18,1,1/1/2024,2/1/2024,2/18/2024,Sunday,Winter,1
2/19/2024,2024,2,19,1,1/1/2024,2/1/2024,2/18/2024,Monday,Winter,0
2/20/2024,2024,2,20,1,1/1/2024,2/1/2024,2/18/2024,Tuesday,Winter,0
2/21/2024,2024,2,21,1,1/1/2024,2/1/2024,2/18/2024,Wednesday,Winter,0
2/22/2024,2024,2,22,1,1/1/2024,2/1/2024,2/18/2024,Thursday,Winter,0
2/23/2024,2024,2,23,1,1/1/2024,2/1/2024,2/18/2024,Friday,Winter,0
2/24/2024,2024,2,24,1,1/1/2024,2/1/2024,2/18/2024,Saturday,Winter,1
2/25/2024,2024,2,25,1,1/1/2024,2/1/2024,2/25/2024,Sunday,Winter,1
2/26/2024,2024,2,26,1,1/1/2024,2/1/2024,2/25/2024,Monday,Winter,0
2/27/2024,2024,2,27,1,1/1/2024,2/1/2024,2/25/2024,Tuesday,Winter,0
2/28/2024,2024,2,28,1,1/1/2024,2/1/2024,2/25/2024,Wednesday,Winter,0
2/29/2024,2024,2,29,1,1/1/2024,2/1/2024,2/25/2024,Thursday,Winter,0
3/1/2024,2024,3,1,1,1/1/2024,3/1/2024,2/25/2024,Friday,Spring,0
3/2/2024,2024,3,2,1,1/1/2024,3/1/2024,2/25/2024,Saturday,Spring,1
3/3/2024,2024,3,3,1,1/1/2024,3/1/2024,3/3/2024,Sunday,Spring,1
3/4/2024,2024,3,4,1,1/1/2024,3/1/2024,3/3/2024,Monday,Spring,0
3/5/2024,2024,3,5,1,1/1/2024,3/1/2024,3/3/2024,Tuesday,Spring,0
3/6/2024,2024,3,6,1,1/1/2024,3/1/2024,3/3/2024,Wednesday,Spring,0
3/7/2024,2024,3,7,1,1/1/2024,3/1/2024,3/3/2024,Thursday,Spring,0
